kalimat,status
ooh ih ohhh uhhh iiih uuh,2
iih uuuh ooh uh iiih ihh ahh ooh iih uuuh aah ehhh aah uh ohhh ah uuuh iih eeh ih ih uhhh oh uhh ah ooh oooh ih,0
ahh ih eeeh eh oooh ihhh iih ahh ihh oh ihhh uh ooh ehhh,2
uh uhh ih ahhh aah ihhh ih oooh uhh iiih ahhh uhhh ihhh oooh uuh uh oh uuh uhhh uhh oooh aaah ihhh ohhh,1
iih ihh iih eh iih oooh ehhh uh ah eeeh uhh,0
ah ohh ohh aah ohh uhhh uuuh ohh uhh uhh eh eh eeh eeh uuh ehhh ooh ih uuuh ehh uhh ehhh ehhh uh ahh aah ehhh uuh ihhh,2
uh uhhh ooh uh ahh,1
iih uhh iih eeh uuuh uhhh aaah oooh oooh eeh oh ih eeh uuuh ohhh uuuh oooh iiih iih eh iih eh oh aah ihh eh aaah aaah uhh,0
uuuh ih ehh ohhh oooh eh eeeh ooh ahh uh ihhh uhh ehh ahh ah ohh,2
eeeh ihh ihh ohh oooh ahh aaah ihhh ooh ah eh ohhh iih iiih uhhh iih eeeh oooh eeh uhh uh ihhh uh uhh ehhh ehh ah aah,0
eh ih iiih ooh ohhh iih ah oooh aah iiih oh,2
aah ih ohh oooh ih ahhh ahh uh oooh oooh uuuh ehh oh iih ohh eh uh,0
eeeh oooh ihhh eh aaah aah ehhh uuuh ahhh ihh ihhh eeeh ohh aaah aah ah ehh,2
uhh iiih aah iih uuuh ehhh eh aaah uuuh ih aaah ooh,2
eeeh ihhh uh ooh uhh oooh,2
uh ih eeeh ih uhh eeh ihhh ihhh eh ahhh oooh uh ehhh ooh ohhh ahhh ahhh iiih eeeh oh ahhh ihh uuuh iiih ih aaah ahh iih ehh,1
ehhh ihh ih eh uhh ih eeh ehh ihhh eh uh ehh uhh eeeh ihh aaah uuuh ooh eh ohhh ehhh,2
ehhh uh uuh ohh ihh eh ooh uuh ahh uhhh eeeh oooh,2
ohh oh ihh iih uhh eeh ahhh iiih ahh iiih uhh ihh ehhh ooh uhh uh ahh oh ehh ihh oh oooh ehh,0
uhh uuuh aah iiih aah ahh uhh oooh eeh aaah ooh,2
uuh ihh uuuh uuuh oooh ohhh iiih ahhh ooh uh uhhh oooh ihh uh ihhh ohh ihhh uhhh ooh aah ih ohhh eeh,0
aaah ohhh oooh uuuh ah ahhh ihhh ohh,0
eh eh ehhh aah uuh ehhh uuuh uuh ehh ih ooh ihh oooh ohhh ahhh ihh uhh iih ihhh ehh ahh oooh aaah uhh ehh ihh iiih ooh eeeh,2
eh ehhh ah ehh ihhh eeh aaah uhhh oooh ihh oooh uhhh aaah uhhh ohhh eeeh iiih iiih iih ohhh uuuh uhhh,0
ohhh ehhh eeh aaah eh ohhh uh ih oooh uhh uuh ihhh ehh ah aah ih oooh eh,1
ihhh ehh ahh uuuh aaah uhh eeh uhh ohh,2
uuh uhh uh aah uuh iiih eh uhh uuh eeh ahhh uuh aah ooh uhh uuh,2
iiih uhh ehhh ahhh ahh oooh ih aaah uuuh uhh ahh aah uuh uhh oooh ihh ohh uhh oooh uuuh iih uhh eeh eeh ahhh ahh ih,2
uhh ahh ohh uhh uhh uhhh eeeh ihhh oh ah ahhh ihhh uh,2
ehhh ihhh ohhh oh ehhh eeh eh ih uuuh ahhh iih ahh oooh ohh iiih eh ehhh ahh ooh ehhh aah aaah aaah uuuh ooh uh oooh ih,2
uuuh uhhh iih eeh eh eeeh uhhh ah ohhh ohhh aaah iiih ahh ihh uuuh,0
ahh ah ehhh uuh eeeh iiih uhhh aah ehhh oh uuh ohhh uhhh ehh ohh ehh eh ih eeh oooh iih oh,1
aaah eeh ohh uh eh,1
aaah eeeh ohhh oooh ahhh ihhh iiih aah eh iiih aaah uuuh iih ehhh ehh iih eeh uhhh,0
oh oooh aah ahhh uh iiih ehh ih ehhh uhhh oooh aah oooh ohh ahh,1
ohhh ooh ahh ehhh uh oooh uuh ehh ah ahh uuh uuuh ih eeh ih uhh oh uuh oooh oooh ehhh ahhh iiih ihh,1
ohhh ehh ih oooh uhh ehh ooh uhhh aaah uh eeeh uuh eeeh uhh uuh eeh ih ahh aah ahh uhh uh uh ihhh uuuh ehh eh ihhh ohh ooh,2
aah ehh ehhh uh ehhh eh oh ohh ehh eh ehh ahh ehhh ooh uuh iiih eeh uhhh eeh ahhh,2
ihh oh iih aaah oooh eh ohhh ehhh iiih,0
oh ih aaah ehhh eeeh iiih ihh ehh eh ih eh ihh ihh eh uhh iiih eeh ooh ihhh ohhh ohh ohh oh eh,2
iih ehhh ih eeeh uhhh eh uuuh oh oh aah,1
aaah oh ooh eeh oh ihh uuh iih ih uhhh uh ehh ohh ihhh ih eeeh ohhh ihhh,0
eeeh oooh ihh ahhh ehhh uhh ohh aaah uhhh ih ehhh ohh,2
ih ahhh ah ooh ehh uhhh uh ihh eeeh iiih,0
aah uh ohhh uh uuh ahhh eeeh oh ehhh ehhh eh eeh eeeh ihh iiih uh ahhh ihh,0
eh uh uhh ih ehhh ihh ih ooh ah iiih ah uuuh ohh iih iiih ah ahhh ehhh iiih uuh iiih aaah oooh uuuh eeeh ihhh uhhh,2
ohh oooh iiih ehhh ih ahh ohh uhh iih iiih aah ah uhhh eeeh eeh eeh uhh iiih ah ahh uuh,2
iih ahhh ooh ehh ahhh eeeh oh ih iiih oh eeh ih ih iiih eeeh eeeh uhhh ahh ihhh ahhh eh ahhh ihh aah aaah ihhh ohh,2
ih ah ehh ooh ih ihh eh ooh eh aaah ihhh ohhh uhh,2
uuuh aah uh uhhh uhh ahh uhh ehhh eeeh eeh uh ohh ahh iiih ahhh aaah uuh ah,2
ooh eeh uuh ehhh iih ooh eeeh uhh ihh aaah aah ehhh uuh eeeh ooh oh,2
iiih ohhh iih ohhh uhh ohh uhh ohh ooh eh ah uhh iiih ahh ooh ihh ohh ehhh eeeh aah uhhh oh ahhh uhh uuuh ehh ohhh uuuh eh eeh,2
aah eeeh ohhh uh aaah ehh uhh ih eeh ihh uh ihhh uhhh uuh ih uuuh iih aaah uh ehhh ehhh,0
ehhh ohhh iiih ooh eeh aaah uuuh aaah uhh ahhh uuh uuh eeh iih iiih,1
ohhh uuuh ehh eh ahh aah ehh aah ih uh aaah eh ihhh ahhh uuuh eh,1
iih ohhh ehhh eh ih eeh,1
iiih aaah uhhh ih iih eh eeeh ihh iiih iih aah iiih ahh ahhh uhhh ih aah ahhh uuh ah ah uhh ehhh uh eeeh aaah uuh ehhh ihh ih,2
eeh uhhh ohhh ah oh aah ohh ehhh ehh eeh aah ah uuh uuh oooh iiih uuuh ohhh ohh uuuh oooh aah eh,0
ooh iih ahh ahhh eeeh uhh ihh ooh uh uhh iiih ahhh aaah aah ihhh eeh eeh uhhh oooh ihh oooh aah eh uhh iih ooh eeh uhhh uuh,1
uuh iih ah iiih ohh uuuh iih,1
ihhh ah ahhh eeeh ahh ahhh aah ihhh oooh ahhh aah iiih iiih iih ah ahh ooh ahh ahhh eh iiih ihh uuh eh ahhh eeh iiih uuh,2
ah ah ehh ohh ooh uuuh eeeh ah ohh iih ohh oh ahhh ehh oooh aah uuuh ehhh ih ah ohh aaah ahhh uh ih uuuh ih uuuh ooh iih,0
oh ahh ih ohh eeh oooh aah aaah uhhh ohhh ih oooh ooh oh ihh ohh ohh ahhh uhh ohhh iiih aah ahh eeeh aaah oh ah ahhh,0
ohh aaah uhh uhh eeeh ooh aaah ahhh ehh uuh iiih oooh uhh ehhh eeh aaah ohh ehh,2
uhh eh aaah eeeh aah uuh ih aaah aaah ohhh uuuh ehh uhh ihhh iih ihhh ahhh ahh ehh uuuh ooh uhh ohh ohhh oh,2
ehh oh uuh ooh ehhh eh eh uhhh,2
aaah ohhh eeeh uh uuh ahhh uh ihhh oooh oooh ahh oooh uhh ahhh ah iih ih ooh iiih ihhh ooh ehh,0
aah ehhh ahh ohh iih uhh ah uhhh uhh ehhh eh uh,2
aah eeh ihh ehhh uuh ohh uuh oooh eh ahh ihh,2
uhhh aah uuuh uhh ihh uhhh iih oh ih ehh ihhh uuh eeeh aah ohh ih ahh ahh oooh,2
oooh ooh eeeh ihh eeeh ehhh iiih uhhh ahhh aaah ehhh ohhh oooh ohh ahh oh,1
iih ohh eeh uuuh aah oooh eh ahhh iih aaah oooh ooh uhhh aah ihh ahhh eeeh iih oooh,0
ohhh eeh iih ohhh ooh ohh iih uuuh ah uh uh iih ehh,0
ihhh ahh aah ahhh uuuh uhh ih aah uh ihh ehh iih ehhh,2
iiih iih ahhh uuuh uh uuuh ahh iiih ihhh iiih ohhh ih iih uhh eeeh ah eeeh uuh aaah uhh uhhh iih ehh,1
ihhh iih ah ooh aaah aah uhh ehhh ohhh uuuh uuuh oooh aah,1
ahhh ehhh iiih oooh ehhh,2
iih aaah ohhh uhhh ahh uhh ihhh eeeh ih eh ehhh uhh ehhh eeh ehhh ihhh uhh,2
ahhh aaah oh ahh ohh ohh ohhh uhh ih ah ooh uh ohhh uhhh ohhh ehhh ahhh uh uh uuh iiih uuuh iiih ahh uuuh,0
ihhh ehh eeh ahh iiih ahhh ihh iih ahhh uh,0
ehh uhhh uuuh uhhh ihhh aah ohhh ohh ooh ehhh ahh oooh ihhh eeeh eeh ihhh ehh uhhh ihh aah uh,1
aaah ah oooh uuh eeh aah ohh,1
oooh ihh ehhh iih iih aah iih ih uuuh uuuh uuh aah aah iiih ih uh iih ehhh iiih uuh uh iih,1
ooh ihhh iih iiih aah eeh aah ah oooh oooh ahhh ehhh ohhh ohhh,0
ahh eh ehhh oh iiih aah,2
oooh iiih iih ohh uhh ohh ih oh uhhh uh uhh ihhh iih aaah uhhh iiih uh,1
ehhh iih eh eeeh oh ehh ohh ohhh eeh,1
iiih ahhh eh aah eeh ehh ahhh aaah eh,1
oooh ohh oh ihh eeh uh ahhh oooh,0
eh oooh iiih uhhh oh iih ehhh aah ahh aah uh ih ahh aah iiih eeeh oh ohh aah iiih ahhh aaah ah ah ehhh oooh ih,2
iih oooh ah ehhh eeh aaah uhhh ah aaah iih ooh eh,0
ehhh ooh ih eeeh uhhh ohh uh ihh,2
ohh uuuh aaah ooh ihhh ohh uuuh ah uuh eeeh iiih aaah aah iih iiih ohhh ahh uh ehh eeh ooh uuuh ohhh eh iih iih uuh uh,0
ihhh uuh ohhh uhh oh oh ih oooh oooh uhh iiih oh iih ah aaah ah ohhh eh aah uh oh eeeh oh ehh ooh iiih ahhh ih ahhh eeh,0
ihhh oh ihhh ihh ehhh eeeh ohh aah ihhh ihh,2
eeeh oh ih uuh ihh uuh ihhh ahhh uuh uuuh uuuh aaah ooh,2
ehh ehhh eeh ah uuuh ehh iiih uuuh ahh uhhh ih aah uuh aah oooh aah ahh ihh uhh,2
ohhh ahh uuh ihh ohhh uuh ooh ah ah iih ehh uuuh eeh uhh uuuh eeh uhh ehhh aah uh ah ooh eh,0
uhh eeeh uuuh uuh ah uhhh uh eeh iih ih oh uhh ehhh aah eeeh uh uuh oooh eh,2
ah ihhh uh ih ehhh ooh ahhh ohhh ohhh uhh ah ih iiih,2
uuh uh eeh oh ahhh,0
iiih iiih uuuh uhhh iih eeeh,1
ehh aah ooh ahhh uuuh oh ohhh ih uh ohhh ahhh uhhh uuuh ohhh ah aah ahhh ahhh eeh iiih ahhh iiih eeh ahhh,0
aaah uhhh oh ah ohh uuuh ahhh iih ehhh ihh eeh ihhh uhh uhhh uhh oooh ahh aah,0
oooh ehhh ohh ohhh uhh ehh eh ih eeh ahhh ohh ooh ihh ohhh uhh uuuh ihh ahh ooh uuuh,1
uhh ihh ehhh ihh ooh ahh ehhh oh ohhh,2
ehh uhhh uuh iiih iih uh uuuh uuh uuh ihhh ahh aah iih ih ohh iiih aaah ehhh eh ooh,2
uh iih aah iih ihhh ehhh ohhh oooh,0
aah ih ohhh uuh ihh uuuh uh ehh uuh uuh ehhh ahh ihh ohh eh ah ih ohh uhhh ahhh ihh iiih iih,2
eeh ahh uuuh uhh uh ihhh oooh iiih eeeh ehhh ohhh oh ihhh,2
aaah uhhh ihhh ihhh ahhh ihh ah ohhh ehh ohhh iih ooh oooh ihhh eeeh uuh ooh ahh aaah,0
uuh eh ooh eh aah ohh iih uhhh oh uuh uuuh ihhh oooh eeeh ohh ah oh eeeh ehh eeeh,2
ih uhh aaah ehh ehhh eeh,1
eh iih ihh ehhh eeeh iiih oooh ehhh ah,2
iih eeeh ooh iih iih ahh uuuh ihh uuh iih ehhh aah ehhh ehh eeeh uhhh ah iiih ih eeeh ohhh uuh ihhh aah uhh iiih uhhh iih,2
ohhh eeeh uh ohhh ihhh uhh ahhh ah iiih ahh,1
ahh aaah ahh uhhh uhhh iih ohh iiih iiih uhh uh ahhh oh ah ohhh ooh ohh,1
ah ih ooh ihh ehh oh uhhh ahh eeeh ehh ehhh ohhh,0
eh eeh iih iiih uuh oooh aah ehhh ahh ohhh eeeh uhhh ah,2
ehhh uhh eeh ihh eh uuh ihh iiih ihhh uh eeeh ahh uhh uhh ohh uuh uhh oooh uuh eeh ohhh,2
ahh oh oh eeeh oooh ehhh uhh ahhh,1
iiih uhhh uhhh uuuh eh ohhh eeeh uuuh uuh ehh oooh oooh,0
ohh oh ihh ooh oooh ehh ahhh ihh eeeh eeeh ihhh eeeh oooh iiih oooh ohh ih eh uhhh ihhh uuuh eeeh iih ah uhhh oooh ihh ehh ihh,0
ihh eeeh iiih ihh aaah oh ahh ihhh eeh eeh uuh,1
aah uhh ihh oh ahhh ihh uh uuh oh eeeh aaah ihhh ah uuuh ihh uhh ihhh eeh ehh ehhh eh ihh aah ihhh ihhh eeh,0
eeeh uhh ahh uh ohhh uhhh uh eh ohhh ahhh oooh eeh uuh ehhh ih,1
eeh ihhh ih ih aaah uuh ahhh ah ooh ohh uhh eeeh ooh aaah ahh uuuh ih,2
oh eeeh uuh iiih uh ihhh ehh ahh iih eh oooh ihhh uuh ihh aaah iiih iiih ih ahh ahhh ohhh uh ih ooh ohh uh uhhh aah ahh,2
aaah ah ihhh ahhh ihhh ih oh eh iih uuh ehhh ihh,1
ahh uh iih uhhh aah uuh eeh ih,1
iiih eh uuuh ohhh ehhh ooh iih oooh iiih iih eh iiih eh uhhh uuh ooh iih ahhh iih eh oooh uhh ohhh ihhh oooh iiih ohh ohh,2
eeh aah aaah ahhh ih ehh uhhh ih ih aah ooh,2
uhhh oh ohhh ah ihh ih ehhh uuh ahh uuuh aaah uuuh eh eh eh ehhh ehhh aaah aaah eeh,0
oooh ihh aaah eeeh ih ah ahh uhh eeeh ohhh uuh oh uuh aah eeh uhh ohhh ehhh ohhh ah oh oh,0
iih ehhh aaah oooh aaah ooh eeh oooh ehh uh uh uuh ehhh ohhh ahh eeeh uhhh ahhh ah uuuh uuuh ehh,0
eeeh aaah ahh oooh ehh aaah oh ehh uhhh eh ooh ohhh ohhh eh uuuh ohh,0
ah ahhh uuh uuh uhhh eeeh eeeh uhh ah uhh ohhh oh uuuh aah ehhh ahh ihh,2
ooh ahh ahhh ohh eeeh uhh ahh ooh ihhh ahhh iiih ahh,2
ahh ohhh aah ih oh aah ahh oh oooh ah oh eh iih ah,0
ooh ah ehhh aaah ah oh ahh ooh ehhh ohhh iiih ihh iih iih,0
ahh iiih eeh ehh ihh ahh uuh ehhh,2
ehh ehhh ohhh iih ohh aah ihh oh ahhh ohhh ehhh eh ahh oooh ooh ohhh uuuh eeh ooh ihhh ohh iiih aaah ehhh eh aah ahh ah,2
aaah ihhh aah ohhh ih eeeh eeeh aaah uuuh ehhh iih eeh ahh uuh eeh eeh eh aaah eeeh,2
ih uuh ehh ehh ohh ooh ohhh uhh ahh eeeh ohh iih,2
uhhh uuuh ehh ahh oooh oooh oh ohhh ih eh aaah iiih eeh eeeh ah ohh uhh,0
uhhh ahhh ah eeeh oh ooh ihhh uuh uuuh ah ooh,1
uuh eeh oh eh ihhh ehhh aah ohhh ehh aah,2
uuuh ohhh ehhh uhh aaah ohhh aah uuh eeh uuh iiih ehhh aah eeeh ehhh oooh ohhh ahh ihhh ohhh aaah uhh iiih ehhh ih uhhh ooh uuuh,2
eh ooh ahh ihhh uhh iiih ehhh ohhh ih aah ah iiih ahhh oh ohh ehh iih eeh,2
ah oooh ehhh ahhh ihh ooh uuuh,0
oh eeeh ihh iih ooh uhhh ih ehh uhh eh oooh ohhh ah uh ohhh ooh uuuh aah oh uh ahhh eeeh,0
eeh eeeh iiih iiih iiih uuuh aaah ehhh ahh ohhh eh ehhh ih ooh ah ahhh ahhh uh aaah iiih uh,2
ihh aaah eeeh ehh ihhh eeeh ahhh ihhh ohhh ohh eeeh uuh ahh oh,2
uhh uuuh ahhh uhhh uhh uuh oh oh ahh ih ahh uh aah ah iih ahh,1
ohh eh iih aah uhh ohhh uuh ihhh eeeh oooh ihh iih uh uuh iih ooh uhh oh ehh ah ihhh eh ehhh ohh ehh,2
ahhh uhh eeeh aah ihhh iiih aah ohh iiih aaah eh uh uhhh ihh ihhh uuuh iih ah,2
uuh aaah ihhh ehh iih oooh ah ahhh oooh ohh uh ohh ehhh eeeh ah oooh eeeh oh aaah aah oooh iiih uuuh ahh eeh iih uuuh aaah,0
uhh oh eeh aah ohh ihhh eh uhh aah ihh uh eh eeeh eeeh,2
aah ohhh uh ihh ahh,1
eeh oooh eeeh eeeh ohhh ih uhh uhhh ohhh ahh uhh ahhh eeh eeeh uuh eh oh ihh ihhh eh ehhh,2
ihhh ihh ohh oh ihhh ihh uuuh eeh iiih uuuh ohh ehhh uuuh iih ooh ehh oooh uhh uuuh ahh uuh eeeh ah,1
ahhh ehhh uhh uuuh uuuh iih ahh ooh eeh uhh ooh ohh eeeh ah iiih,2
ah ah uhhh uuh oh ohh uhh ahhh aah ihhh ih ah ohh aaah eeh iih eeeh ooh ooh uuuh,1
uhhh ohhh ohhh eeeh iiih uuh ehh ahh oh aaah uh ihhh uuuh ohhh aah,0
aaah uhhh aah uuh ooh eeeh aah eeh iiih uuuh ahh aah ohh,2
ahh ih ih uhh ih uuh eh uhh ooh eeh ehh oh ahhh eeeh uuuh ihhh uuh uhh uuuh oooh ihhh ihhh ah aaah ihh ohh ah ihh ehhh,2
ahhh uhhh uuh uh oooh ehh,0
oh iih ah iih ihhh ah ohhh uhh aah,0
uhhh aaah ehhh iih ihh ihh eeh ehh,0
iih uuuh eeh ehhh oooh ih oh aah eh ohh uuuh ahhh aaah ehhh ah,0
uhh eeeh ehh eh ihhh oooh eeh ih uuuh ahhh ahhh eeeh uhhh ohhh eeeh uhh iih iih,0
uhhh ihhh uuh ehh ihh uhh ihh aah ehhh uhh ahh uuh aaah aaah aah uhh oooh,2
ahh ohh ooh oh ehh iiih ohhh ih oh uuuh iiih ehhh aah,2
aaah uhhh uhh uuh aah ahhh oh uh uuh,1
uuuh eeeh aaah aaah uhhh,0
aah uuh aah ahh uuuh aaah eeeh ohh ehhh ohhh uhhh iiih uuh aaah oooh aaah uuuh ohh aah oooh ihh ehh ehhh eh eh,2
ehh ohhh oh oooh eeeh aah ih,1
ooh uuh uuh ihhh ehhh ihhh eh ehhh ahhh ehh aah uhhh ihh uhhh aah aaah ohhh ooh aah ohhh iih aah ohh iiih,2
ihhh eh oh ahh uuh eeeh ah,2
ahhh uhhh eh eeh oh oooh uh eh uuuh oooh ihh ih iiih oooh eeeh,0
eeeh ahhh ihhh ihhh uh ahhh ooh ahhh ihh eh ih uhhh aah ahh aah eeeh ohh eeeh ahhh iih ahhh oooh uuuh ohh ohhh iih,1
ihh uh uhhh iih aaah eh eeeh eeh ohh iiih iih ooh eeeh ih ih uh oh uuuh ohh eeeh,1
uuuh ehh ohh eeeh oh ohh ohh,2
ihh ih ooh uhh oh ehh uuh uh ah iiih ohhh uhh ohh ooh,2
uh ohhh oh uuuh oooh oh ihh uhh ohhh uh uuh oh oooh ihh ihhh,0
ahhh oh uhh uuh eeh ooh eeeh ohh oh eeeh ooh eeh uhhh eeeh ahh oooh eh oh aaah ahh eeh aaah uhhh,1
eeeh ohh uuuh eeeh ooh oh ahhh ehhh iih ahhh ah ohh ehh uuh ohhh aah uh ehh ehh,0
aah eeeh uhh oooh ihhh eeh uuh ooh eeeh aaah uhh eh oh uuuh uuuh ehhh ih,2
ihh iih ehhh uhhh ahh aah uuh aah eeh eeh oh iiih oooh aaah aaah aaah uhh eeeh,0
uhhh uuh ahh uuuh ahh ohh ehh uh iih ooh uhhh eeeh ehh aaah ahhh uhhh,0
uh aaah ohhh ah uhh ahhh ehh uuh iih oh uh ohh uuh ihh,0
ih iih uhh ahh ihhh ihh uh ih aah iiih uuh oooh aah uh aaah oh iih uuh ahhh iiih eeh iih iih iih iih ih aaah oooh eh ohhh,0
ooh ooh ah uh aah oooh iih ihh ehhh aah ehhh uuh eeeh uh ihhh ohh ah uuuh ehh ahhh eh eeh eeh eh ahhh ahhh,0
iih ahh ehh ohh ahh aah oh uhhh ehhh ihh ehh uhhh ih ohh ehhh ooh,2
ihh ihhh uhhh ohh ahh ooh uhhh,2
ohhh ih uuuh uuuh ihh,0
eeeh ihhh eeh eeh ohh aah eeh uhhh oooh aah eh ehh ohhh eh oooh uhhh aah uh ah ahhh aaah ihh ih oh ah uh,0
eeeh ehhh oooh ehh aaah ahh ehhh ahhh,1
ehhh aaah ehh iih ih ohh ih aah oooh eh ehh uuh ehh ahh iih ohh aah ehhh uh aah ohhh aah uh ehh uhh iih ohhh,2
ohhh ohhh ehhh aaah uhhh oooh ooh uuuh oooh eh ehhh oh eeeh ehhh eeeh ahh ihhh uh uuh oooh ohhh ohhh,0
ooh iiih ohhh uh ehhh ah uh ahh ohh eeeh ahhh ah ah ohh oh uuh eeeh ihh ehh,1
ehh oooh eeh ehhh iiih,1
ihhh iih iiih ihh eeeh ohhh uhhh ahhh eeeh ahh aaah,1
eeeh aah ahh aaah ooh ihhh,2
iiih iih eeh eh ih oh,1
uhh ih ahhh uh uuh iiih aah uuh ohhh,2
ih iih ihh uhh ihh oh ih ihhh aaah oooh ehhh aaah ooh ohhh ohhh ih uuh ehhh ohhh ohh uuh ohh eh aah iiih eeeh,2
ohh ihh oh uhhh eeh ih aah uhh uuuh uuuh uhh iih uh,0
ooh aaah uhh iih uuuh uh eeh uh iih uuuh uhh oh uh,0
ehh ehhh iih iiih ehh,1
ah uh iih eh eh aah,1
ehhh ehh ehhh ohhh eh ehhh uhh uuuh eh eeeh ehhh aaah uhh aah aaah eh ihhh uuh uh,2
ahhh uhh eeeh ih ah ahh ehhh ooh ooh oooh aaah ah ohh iih iiih eeh uh eh oooh ah oh iih iiih eeh ooh,1
oh ahhh ah eeh uuh oooh oooh ohhh ooh uhh ohh oooh oooh ih ahhh aah ohh ehhh uuh eeeh ih ohhh uhh uhhh ahhh uhh ih ohh,2
ihh oh uhhh eeh eeh oh ehh eh aah ihhh ahh aah iih uhhh ihh ehh ah uuuh oh oh eeeh uhh oooh eeh ohh uuuh ohhh ihhh,0
ihhh aah eh uuuh eeh ehh ehhh,2
ehh eeeh oh ihh uhh ohhh uh oh ooh uuh uuh aaah ihh ehh aah oooh uuh aah aah uhhh ehhh,1
aah eh uuuh uuh aah ehhh uh eeh ah ihh ohhh ehh ohh uh aah ehh,0
ehh ohh ehh ohhh ihhh ehh iih uh aaah uuh ahh uuuh uh oooh eh iih iih,0
ahhh uuh eeh uhhh ooh aaah eeh ahh ehh uh iiih aah eh iih aaah ahhh,0
ih ohhh eeh aah ihhh ih uhh ihhh eh ohh oh eh,2
ah oooh uhhh uhhh ahh ohhh iiih iih iih ohhh ehh ooh uh eeeh uhhh ohhh uhhh,0
ihhh uhhh oooh iih iiih ih uhh ah uhhh ahh aah uhh ah ooh ooh oh eeeh oh oooh aaah uhhh eeeh ohhh ooh iiih aaah oooh ahh ahh,2
eeeh iih uhh eh uh ehh iih aaah ah uh ohhh aah iih ah ah eeeh oooh eeeh oh eeh ih ih uh eeh eh uuuh ehh,0
iih iih uuuh ah ehh ihh uhhh ohh ooh eeh uhhh oh uuh oh eeeh iih eeh ahhh eeh,0
ih aah ihhh oooh ooh eeh eeeh ihh ohh iiih oh oh aaah ih aah oh oh oooh iih ahhh uh ih iiih ohhh iih,0
aah ihh ehhh uuuh ohhh aah ah uuh ooh ih aah ooh ooh,2
ahh iih ohh oooh uhh aaah ih ih ooh uh eeeh ahhh iih ah uuuh ihh uh ohhh ahh uuh iih eeh eh iiih uuh iiih ihh ihhh uhhh uuuh,0
uuuh aah uh uuuh oooh ehhh iih ohhh ihhh iih oh aaah ehh ihh ahh uuuh eeeh uuuh ohh ohh eeh uh oh eeh uh ih uhhh ihh ohh,0
eeeh uuuh ih aaah aah eeeh uhhh uhhh ahhh ehh iiih uh ahh ehhh ihh aaah ooh oooh eeeh uhh ooh ahh eeh uuuh iiih uhhh ah oh ahhh ohhh,0
ihh uhhh aaah ihhh ehhh ihhh ohh aah uuh ohhh eh uhh ahhh ihhh,2
ahhh oooh iiih ohhh uh ihh ah oooh ahh uuuh,0
ahhh ahhh uuuh oooh uh uuuh uuh uuh uuuh uhhh oooh aah ihh ihh ahhh eh uhh eeh,0
oh iiih ihh eeh uhhh ehhh ahh eeh oh ohh eeeh uuuh eh oh ohhh eeh eeeh ihh aaah ooh oh ih eeh ehhh uhhh ooh,0
ooh uuh uuh ohh ehhh ohh eeeh uh ehh aah ohh ihhh aaah,2
ohh ehh ahh eh oh uhhh ohh uuh ehh uhh uhhh ehh ooh aaah ehh eeh ehhh uuh uhh uh eh ehhh iih oooh aaah uuh iih,1
uuuh ihh eh ahhh eeh ahh iiih ihhh uuh aah aaah uh oh ih uh,1
ohhh ehh aaah eeeh aah ohh aaah ehh iiih,1
aaah oooh ohh ahhh aah ehh aah aaah eeeh aaah,0
ooh uuuh eeh iiih ohh ohhh iiih uh oooh ah ooh oooh ohh ohhh ih,1
ehh eh oooh oooh iiih ehhh uhhh ooh eeh ah eeeh iih ohhh ihh uuh uuh ih eeh eeh ah iih eeeh ooh ooh oh aah eeh ehh,0
iih ooh ohh iih uuuh eeh ahhh eeh ah eeeh eh ohh ohh iiih ahh iih ih ohhh eeeh eeh ih ihh aaah aaah ehhh,1
aah uuuh uuuh uhh uuuh ehh ihh uhhh ah,0
iiih ihhh uh uuh ehh,2
eeh ah uuuh uhh ah ihh,0
aaah oooh ooh eeh oooh ohh uuh ahhh oooh eeeh ahhh oooh ohhh ahh ihh ihh eeeh uuuh ihh uuuh,0
ah uh ehh uuuh iiih ooh iiih aaah ah ooh iih ooh oh iih ahhh ohhh eeeh eeeh uuh ah uhhh ehhh aaah uhh,0
aaah iiih ihhh uuh eeh ohhh,1
aaah eeeh eh iih eh,2
iiih uh uhhh oh ehh uh ihh ahhh ahh ihhh oooh ahhh eeeh aah ohhh ihh eeh,0
eh iih ah ihhh aah uhh uhh ih iiih eeeh ehhh iih ehh ehh ooh uuuh oh ehh ehh oooh uuh aah,2
oooh ih uhh ooh uh ihhh,2
ih uh iih ehh ohh aaah ihh ihh uhhh ah ohh ohh ehhh oooh ah ehhh eh ihh ahhh ahhh ohhh ehhh aaah ahhh eeh ahhh ehhh oooh ehh aaah,0
ihhh ahh aah uh ehhh eh aah ih eeeh iiih uhhh aaah ehhh oooh aaah eeeh uuuh ooh oh uhh oooh ahhh uhh oooh oooh ah eh,2
uhhh oh ihhh ohhh ehh ehh ihhh oh ahhh uuh ih oooh aah uuh ohhh eeeh oh uhhh ooh ooh aah ohh ooh ohh ehhh oooh,2
ah eh oooh ohhh ahhh ahhh ohhh uhhh iiih ehh ahhh aaah iih oooh ah ehh ih uuuh ooh ahh ehh ihhh ahhh oooh uh uuh eh eh ohh,0
iiih uuuh uuuh ahh ah ohh oh ehhh ihh uuh uh ahhh ehh aaah ohhh uhhh ehhh ahhh ihhh aaah uuuh ahhh aaah ah ihh oh ehhh eeeh ohh,0
ooh ohh eeeh aah uhh ooh ooh oh aaah oh aaah ih oooh ohh iiih ehhh ehhh aah ohhh ah,2
ih iih uuh aah ihh ehhh,2
uhhh ooh ohhh uuh ohh uhhh oooh ehh ahhh eeeh ahh ooh ihh eh uhh aah ohh aaah ih oooh eeeh eeh ehhh eeeh ahh eeh uh ehhh ohhh,2
ohh ehh uhhh oh ehhh aaah ih ih iiih ohh aaah uh aah iih aaah ohhh ihhh ooh ehhh uuh aah,2
ihhh ihhh oooh ihh iiih uuuh ah oh aah ehh ohh uhh eeeh uhhh ah ohh uuuh uh ihh uhh eeeh,1
ahh ah oooh ah oooh,0
uuuh ih uuh iih ehhh eeh ooh,2
eeeh eeeh uhh ohhh oh ehhh aaah eeh ih aaah ohhh ahhh iih uh oh,0
ehhh eh eeeh ahh ehh uuh ihh ahhh eh ihhh aaah aaah aah oh,2
eeeh uh ahh eeeh ooh uuuh ihhh ooh ohh eeh iiih ehhh ahh uhhh eh ohhh ah ih ooh aaah ih ahh ooh ih iih eeh ooh ahhh,2
uh ahh ihh iiih ooh eh,2
ohhh ihhh uhhh ehh oh ohh ahhh ih iih ih,0
ah ahhh aaah uhh uuuh aah iiih uhhh ahhh iiih ihhh oh uh ehhh oh uuh uuh eeh ih ih ih,2
ooh ehh uuh uuuh aaah oooh uhh uuuh ooh ahh eeh ihh ah,0
uhhh ihhh ihh uhhh ah oooh ehh ihh uuuh aah uh ohhh ehh uuuh ihh ahh ihh eeeh eeeh oooh aaah uh eeh iih oooh uhh oh ih ohh eeeh,0
uhhh iiih ahh uhhh uhhh ihh aah ahh uuuh ehhh iiih,2
ohh uhh ehh oh ihh ohh ih ihh iih,1
ih iiih iih aah uhhh uuuh,1
eeeh uuuh oh ohhh eeeh,1
uuuh ihh ooh eeeh oooh ahh aah iih ohhh ih oooh aah eeh uuh uhh uhh ihh eh iiih ehh uuuh uuh ehh uuh eeeh uh ahh ohhh,2
uuh uh aah eh ahh eh uuh iiih oh oh iiih aaah ahhh ooh aah ohh ihhh eeeh uh ihhh aaah ehh ehhh ohh ih uhhh,2
ih aaah ihh uuh ahh ooh ohh uhhh aaah uh oh eeeh,1
ooh iiih uuuh ohh uuuh aaah ih ehhh oh aaah uuuh ih ooh uuh ahhh,2
ohhh eh ahh ehh eeeh uhh uuuh uh ih uh uuh aaah ahhh uuh eeeh,2
oh ihhh iiih ohhh ohh eeeh uhh oooh ihhh ohh uhh ahh ehhh ehhh ihh uuh uuh eeh ahh uuh uhhh ohhh iih iiih,2
oooh eeeh ahhh ahh ahhh uuh,1
iih ooh ahh uuuh ooh ahhh ahhh iiih ihhh uhhh ohh ahhh aah ehh ah uuuh ehh iiih eeh aaah ooh ih ehh ah aah,0
ehhh aaah aaah aaah ehh uuuh iiih ih uhhh eeh eeeh ihhh aaah ahhh aaah ohh ihhh ohhh ohh uhhh ehhh eeh uhh ooh oooh ooh ahhh aaah ah ih,0
aaah uh ohh ohh eeh ahh aah ahhh aaah ehhh ah ih oh ah aaah ohhh ihhh eeeh,0
ohhh uuuh aaah ehh eh eh ehh ih ooh ihhh eeeh eh uuuh ohhh iiih ehh ehh ih ihh ihh aah,1
ihh ihhh ihh ihh oooh uhh aah ih uh ahhh ahh,1
ehh aah aaah ah ooh,1
iiih ohhh ah uhhh aah ooh iiih uh ihh ahhh uh ah oooh iiih uh uuuh ah uuh uuuh ohh ehhh iiih ih iiih aaah uuh ah uuh aaah ihh,0
ohh ohh ohh oooh uhhh iih eeeh ehh ehh aah ih eh iiih ehhh ohhh uuh,2
uuuh ooh uuuh ooh oooh ehhh ehh uhh ah eh oooh aaah eeh ehhh ehhh eeh ehh ehhh ehh eeeh ohh,1
ehhh uhh ah ahh eeh ooh ihh uuuh aah ahhh ohhh eeeh uuh ah uuh eeh uuh eeh ehhh aaah ihhh uhhh ohh aaah uuuh iih oooh uuuh uhhh eeeh,0
ihhh eeeh uhhh uh aaah ih ehhh uhhh aah uhh aaah aaah aaah,1
ehh uuuh oooh eeh uuuh uuh ahhh eh ih ehhh uuh ihh eeeh ahh uhh ahhh ohhh ahhh ah uhhh uuuh,0
ahhh ah oh uh ehh ihh ehh uh oooh aaah ihh ohhh uuuh iih eeh ohh uuuh uhh iih eh iih aah ooh ahhh,0
ooh uhh iiih ihh ah uhhh uh uhhh ahhh ohhh iiih eeh aaah uhh ih oh eh oh aah iih,0
ahhh eeeh uuuh aah ehh eeeh iih ihhh ihhh ah oooh ah eh uuuh uuuh uh ahhh uuh ehhh aaah eeh uhh ahh ahhh aah uuuh uhh aah ihhh,1
uh uuh ihhh aaah uuuh uh uuuh ooh ooh uhh ohh ehh uuh ihh uhh ooh ehhh iih ah ahh oh ihh aaah iih,0
ih ah aaah ehhh ehhh uuuh ohhh uh ih ahhh ehh ihhh ooh uhhh aah ooh aah eeh eeeh eeeh ihhh uh oooh iih,1
aah ihh ohh eh uhh oooh ih oooh oooh ihhh ohhh ahhh ehh eh uh oooh uuh uh eeeh uhhh ahh aah uh aaah ahh uhh uhh,2
ah iiih uuh iih ahh ohhh,1
ahh oooh ah uuh ahhh,1
eeeh ohhh aaah oh ahhh iiih eeh uuh uh uh uuuh ohh ih iiih oh uh ihhh ahh,0
iih ohh iih iiih ohh ihh iih eeh eeeh uhh ehh uuuh iih uuuh ihhh ahh oooh oooh uhh aah ehh oh eeeh aah,0
eeh ehh ohh uuuh uhh ohhh ahhh ahhh ihhh ohhh ahhh ahhh ahh uuh oooh ahhh ehh ooh ooh uhh ahhh eeeh ah iih iiih ooh ihh uhhh ohh uuh,0
oooh ah uhhh oh ihhh uh oh uh aah ahh ihhh aah uuuh uh ih oooh ahhh ohhh eeh ohhh,0
eeh ooh oh uuh uuh oh ehhh eh ihh iiih aah eeeh ohh iiih ohhh uuuh uh ihhh ehh ihhh ihhh aaah uhhh aah ahh,2
ihh ohh eeh uuuh uh ehh eeh ehh ohh eeeh ih iiih ihhh eeeh,1
uhhh eeh iiih eeh oooh aaah oooh,0
ehhh ihhh ohhh uuuh iih ihh ah eh uh aaah,0
iih iiih ah uuuh uuuh uuh eh uhhh ahh ahhh oooh iiih ahh iih ihhh uuh eeeh aaah eeeh uhhh ih ihh ehh eeh ehh ahh,0
ih ehhh iiih ahhh aah iih,2
oh ihh oh uuuh iih ehh iiih oh uuh iih uhhh ehhh eeh uhh ehh oh iiih uuuh aaah ah ihh uhhh ohhh ehhh aah iih ehhh ooh,0
ah aaah aah eeh ihh ihhh eeeh ihhh uh iih ooh oh ehhh eeh ehh aah uuh ihhh,1
uhh ihh uhh ah eeh ihh uuuh ooh uhh ihh ehh aaah,0
ahh ahhh ehh oooh ehhh ih eh ahh uuh uh uuuh ihhh ooh ah aah iiih uhh uh ooh oooh iiih uhhh uuuh oooh oooh eeh aaah ah,0
ehh eh oh ah ehh ooh uuuh ah ohhh ahhh aah ihhh ohhh ah ihhh eeh ah eeh uhhh ahh aaah ooh uhhh uuuh iih iiih uuuh ihhh,0
uuh uhhh aah uuh ooh,2
ihhh ih ahhh aah ihhh ohhh uhh ooh ahh,2
ehhh uuh ohhh ihhh ohh eeh ehhh aaah aaah ah uuh ihhh uuh ahhh,2
ohh ahhh iih aaah ehh uuh uh ah aaah uuuh ehh,0
ihhh ooh ohh oh ehhh aaah ah ehhh ohhh uhh,2
ih ehhh iih ehhh oooh uh ehhh eh uuuh ooh aah ihhh iiih uhhh aaah uh ooh uuh ohh oooh ohhh,2
ohh oh aah uuh ahhh ahhh eeeh ooh ehhh eeh uuh uhhh ahh aah,2
ohhh oh ooh eeeh ahhh eh ooh iih ooh oh uh uh eeeh ahh uhhh ihhh ihh eh uhh iiih eeeh eh uhh oh eeeh oh ohh,2
uuuh uhhh ohhh aah oh eeh ah ohhh ooh uhhh uhhh ihhh,0
aaah ihhh uuuh uuh eeh ihhh ohh ahhh ooh uhh oh uhhh,1
ohhh eeeh ahh ahh eh oh ih uhhh ehh ih ohhh aah uuuh eeeh ihh ahhh ehh ihhh ohhh uhhh eeh ahhh uhhh oooh uuh ohh,0
ah eeeh uuh ihh ihhh uh ih ehhh ohhh ihh oooh eh,1
ih eeh uh ihhh ohh ah eeeh ehh oh ihhh uuuh eeh aah ih oh oh ahh oooh ehhh eh uhh ohh iiih uuh ahh iiih ahh,2
ooh uuh eeeh eeh ohh eeeh ohhh uhhh aaah aaah eeeh ahh iiih ooh,2
oooh ohh oooh eeeh ih ih uh ihh ahh uh iih,1
ah iih uhh ihh iiih eeeh uuh aaah ehh uuuh uh,0
ehhh eeh eh iiih ahh oh ihh aaah ehh ehhh uuh uhhh ihhh ahhh aaah eh eeeh oooh,1
uuh uh uuh uhhh eh ah oh iiih uhh iiih aaah uuh iiih aaah aaah ehhh uhh eh uh aah ooh ihhh ohhh eh iiih,2
uuuh ahhh oooh uhh eeh uhh aah ihhh ooh ahh oh ohhh iih uhhh ihh ohh eeeh uuuh uh ihhh aah ohh eh,2
aah oooh uuh ehhh uhh ooh ohhh ehh ahh ooh aah ehh eeeh uuh ehh eeeh ohhh aaah aaah uhh ooh uuh,2
aaah oh uhh aaah iiih ohhh ehhh ehhh ahhh uhh ah ihhh eh ahhh ooh iiih ihhh ehh ahhh uuh uh iiih ehh ihhh ohh,2
uuh aah ihhh aaah eh aaah ihh oh ohhh iiih uhh ihh ah ooh oooh oooh uhhh ooh ih uh ahh uh ahhh oh,0
ah ehh ahhh oh oooh aah,0
iiih iiih uhhh ihhh eh uhh uhhh ahh ih oooh ohh ihhh uh oooh uhhh ahh ihh ih ahhh ehhh,2
uhhh uh iiih iih ehhh ehhh ihhh eh iiih oh ohhh uhhh uuuh iih uhh ah ehh uhhh ehhh ahh uuuh aah eh ehhh ihhh,2
aaah oooh ahh ehh ohh uuuh ihh ehh ahh iih,0
ahh ohhh uuh ih eeeh ehh ihhh iiih,2
ihhh eeh uh ihh eeeh ehh oh ahh uuuh ihh uh eeeh ohhh oh ihh iiih ooh eeeh ohhh uuuh,0
aaah eeh ihh ohh oh ohhh ahhh oh aah ehhh uuh oooh ohh ahh ooh iiih iih uhhh uuh ehhh ihhh ih ohhh uhh uuh,2
