kalimat,status
ehhh iih iiih ihhh eeeh ih eeh ih eeh uhhh ooh ih iiih ih eh ahh eh uhh ohh uuh uuh uhhh eh ah eeeh,2
ehhh ihh ehh uuh uuh aaah oooh aaah uh eeh ih ohh iiih ahhh aaah,0
ihhh eeeh ohhh ihhh ehhh uuh ahhh ihh eeeh ihh ihhh ohh eeeh iih eh uuh ahh eh eeeh uuh oh uuh ohhh oh ihh iiih ih uhh,2
uuh ihh eeeh aah aaah ihh ohh oh ahhh ih aaah aaah iih eeeh iih uuuh uuuh ooh oh uhhh ooh ahh ahhh eh eeh ih eh,0
uhhh ehhh aaah ah uhhh ahh uh ohhh ohh ihh eh ohh ohh ahhh eeeh uhhh aah eeh ihhh ohhh ahh ahh,1
ah aaah uhhh ooh iih iiih ahhh eeh aaah uuh ooh ehhh iih ah ahhh oh oooh uhh eh ihhh uhhh aaah ih uhhh oooh ohhh aah eeh,0
aah uhh uuh eh ehhh aah uhhh oh oooh eh ihhh ahh aah ihh ih ihh oh iiih aah uhhh eeh aah,2
uuh uhh aah uuuh iiih uh aah ahh ohhh aaah ooh ehhh ehhh eh ahh eeeh eeh eeh ahh ihh aah uuuh ehh ehh eh ahhh,2
ihhh aaah ohhh ihhh oh eeh,0
uh ihhh ooh iiih oh aaah,1
ah ohh aaah iih eeeh ohh uhhh uuuh uhhh,0
uuh oooh eeeh uhhh eh iih ih ihhh ehhh ah ooh ohhh uuh,2
ihh ihhh eh ohhh ihhh oh aah ihh ah ihhh ahh ahhh ahh iih,1
eh uh ah ahh ooh uh uhh ahh uhhh iiih ohhh aaah ohhh uhhh ohhh ohh uuuh uh eh uuh oooh eeeh aaah ehhh iiih aah aah ohh iih,2
ohh ehh uhh oh eh uuh oooh ahhh ohh ohh ehhh uuuh ih ahhh oooh iiih uh ihh aah ohhh uhh ih eeh aaah uuh oh uhh uuuh,1
uuuh ooh oooh uuuh ehh iih aah ahh ehh ohh ohhh iiih ohh eeeh ahhh ah aaah,0
aaah ooh uuh iiih ooh oh uhh uuuh ahhh aah aaah eh eeh ohh eh uuuh oh ih aah oh ehhh uuuh oooh ehhh eeeh iiih,2
aah ehh ehhh ehhh ah ah uuuh ih uuuh uhh ihh uh aah,1
ooh eeeh ohh ih uhh aah ooh ah ehh uuuh ahh aah aaah ih oh eeeh ihh eeh eh ohh,2
ah ihhh ehhh uhhh iih uhhh ohh ih ahh uh uuh ehhh ihhh eeh eh ahhh uuh ahhh oooh ihhh oooh ohhh eeeh ihhh ehhh ahhh ah ih ehhh ehhh,2
ehhh aaah iih oh ehh ohh aaah ohh aah aah ihhh uhh oh iih ehh iih ahhh oooh,0
ohh aaah ooh ahh uhh oooh iiih oooh uuh iiih ohhh iih ah ahhh ehhh ihhh ahhh oh aaah uh ihh ihhh,0
ohhh uuuh eeh ehh ehh ohhh oh ihhh ehh,0
iih ihhh oh ihh uh aaah iiih aah ohh ohhh ehh eh uhh ihhh ih,2
eh ihhh ooh aah oh eeeh ehhh ooh uhhh uhh ahhh ehhh ooh uuh oh uhhh aah ah ooh ih aaah aah iih ooh,2
aah uuh eh eh iih ih uh ooh iih,2
eh uuh ohhh ooh eeh,2
aaah uuh ahhh aaah eeeh ooh,1
ih oooh ah iih ihh uuh iih ahh uuh uh ihh ohhh uh aaah oooh uhhh ahhh oooh,0
ah ooh ehhh uhh ohhh ah ah ohhh ihh ooh,0
uuuh uh uuuh oooh ehhh ohh aaah ahhh ohh ehhh uhhh aah ohhh uhhh eeeh aaah iiih aaah uuuh ihh uuuh oh,0
ihh aah uhh aah eh iiih ehhh eh uuuh uhh iih eeeh aaah,2
ih aaah uuh ehh ohh uhh ih uhh ih uhh oh ohh ohhh oh ahhh ohh ehhh oooh iih aah,2
ah aaah aaah eeh iih ihh uhh eeh eeeh eh oh ih ehh oooh ahhh ih uuh ah ohhh uuuh ooh iiih aaah eh,0
oooh iih ihhh uuh uuuh oooh ah aaah ohhh ehhh aaah eeeh eh eh aah eeh eeeh aaah uhh eeeh oh eh uuh eeeh ehh uuuh ehh uuuh aaah ahhh,0
ah uuuh eeh uhh uuh uuh uhhh ohhh ooh iiih aaah uhh uuuh eh eh uuuh eeh aaah ohhh ehhh ooh aah uuuh aah ahh aah iih ahh iiih,2
eeh eeeh oh eeh eeh ooh ah ohhh ehh ahhh ooh iiih oooh uuh eeeh ahh uh uh eeh ihh eeh ehh oooh ehhh ooh aah oooh ihh uuuh uuuh,0
ehh ahh eh oh ihh uhh aah,2
aaah oh eeh uhh eh iih ehhh ihh ooh oh ehhh iih oh oh oooh uhhh uhh ahhh iih oooh uh ohhh ehh,0
ooh uhh aah ahhh eeeh oh iiih iih uhhh,2
ooh oh eeeh ohhh ihh uhhh uh uhh,0
uhh ihh ehh uuh aaah aaah ooh ahh ih ohh oooh ahhh ih aaah ahh uhh uuuh uuh ih oooh ohh ohh ohh ahhh iih ih,2
uhh uuh ahh aaah iih uuh ehhh ehh ahh aaah eh ahh oh ihh iiih uuh uuuh ehhh ehh ahhh,2
ooh eeh uh iih ah uh ah uh uuuh uhhh ah ahhh uhhh eeeh ehh ohhh eeh,0
ohh eh ahhh eh ihhh ohhh oooh uhhh ihhh iiih uuuh ih ohh ehhh ooh ihhh aah ehhh oooh ohh ehh iiih ehhh ehh ih aah uhh ooh,2
ohhh eh aah eeh ehhh ehh eh aaah iih eeh ih aah uuuh uhhh eeh uhhh ohh eeh eeeh ohh eeh uh uhhh ehhh,0
uuh uhhh eh uuuh eh ohhh ahh ih uuh iih aah ah ah uhh ahhh eh uhh ih ehhh,2
ooh aaah uuuh iiih uh ah eh ehh eeeh eeh uuuh,0
aaah eeeh ooh uuh ooh ehh ah oooh uuh ihh iiih aaah ehh oooh aah uhhh aah uhhh eeeh ehh aaah eh ehh ehh ihh aaah ohh,0
eh ahh ih eeh uhh ihh eeeh ohhh ohhh oooh aaah oooh eeeh iih ooh uhh eeh eeeh ehh ohh uuh,2
oh uh ohhh iih ohhh uh ooh uh aah eh aaah ah ehh aah oooh oh ahh ohh ohhh iih iih eeh eeeh,0
ehh aaah iiih ehh oooh aaah oh ihhh ehhh eh eeeh uuuh ihh iih ooh uhhh uuh eh uhh iiih ihh uuuh oh ohhh iih iiih ahh,0
ihh ahh ohh ehh ih aaah ahhh aaah uh iih ehh ehh ah uuuh,0
uh ohh ehh ih uh ehhh ah eeeh uhh oooh ooh ohh ohhh eeh oooh uhhh,0
ihh uuuh oh oooh uhh uh iih ohhh aah aaah eeh ihh iih,0
ehh iih ehh aah eeh ihhh ooh uuh uh aah ihhh ooh aah ohhh eeeh ohhh ihh ih ih ehhh uuh ahhh ah ihhh ohh ihhh ohhh aaah,2
iiih ohh ehhh uuh eeh ih uhh eeh aah ihhh ahhh aah uh uhhh eeh ihhh ohhh ah ah uhh uhhh ahhh uhhh iih ehh ahh eeeh uhhh ohhh oooh,0
ihh uuuh ahh ohhh aaah ahhh uhh iiih eeeh ih ahh eeh aah ihhh eeh eeh ih ahhh aaah uhh uhh,2
ihhh ohh aaah eh ahh eeeh uhhh eeh ahh uhh eh iih eh uuh aaah uhhh uuh ahh aah eh ah aah aah uuh uuh ah aah ohh uhhh oooh,2
eeeh ih aaah uuuh uhh eeh aah ihh ooh uhhh ehh ehh ooh uuuh ooh ohh uhhh ohh ihhh aaah ahh iiih eh ehh ahh ehhh ah uuh eeh ihh,2
uh ihhh oooh ahh iiih eeh ah aah ooh aah eh ehh eeh ooh uuuh ehh iih ahhh uhh iiih uh oooh ehhh uuh ooh ehh ohhh uuh,1
eeeh ahh eh eeeh ih ooh,2
iih ahh ohh eh uh ohh eeh uuh uhhh,2
ooh uhhh ohhh oh ihhh uhh iiih iiih oh,2
uhhh uh ih uh aah eeeh iih ah eh ihhh ahh iiih ooh iiih ihhh ehhh aah ooh ehh eeh ahhh eh ehhh ih uh uhhh uuuh ihhh uhh,2
ehhh eh ahhh ooh uhhh oooh ahhh ehh ahh aaah ahh ih,1
eeeh ahh ohh ih eeh ih ahhh iiih iiih ahhh eeeh uh ehhh uuuh uhhh iiih ihhh uh uhhh uh uuh oh iih uh ooh eh ohh eh,2
uh ihh aaah ohh uhhh iiih uhhh iih ehhh ooh uhh aaah ahhh ih iiih iih,0
ih eh uhhh iih ah eh iih oh ihh ihhh eeh ih ohhh iiih,0
uhhh ihh aah ooh ahhh eeeh aaah aaah ah uhhh ah uuuh oh ih ah uhhh aaah ohh uhh oooh ihhh,0
ihhh ihh ihh oh iih eh ehhh eeeh ihhh uh uuh uuh ihh ehhh ooh,2
ah ehh aah ihhh ihhh ih ooh,2
aah eeh oooh uuuh oh ehh,0
ooh ohhh ohhh ahh uh eeeh ohh aah aah aah ohhh eeh ehhh aaah ehhh ohhh ohhh uuh eh oh eh aah ehh uuuh ohh ohh iiih iih,2
iih ehh iiih oh oh iih uhh uuh iiih aah ah eeeh ih ah aaah eeeh,1
iih ehhh ooh uuh ahhh eh ihh eeeh iiih ahhh aah oooh ihhh ohhh ihhh ihhh iih ehh aah aah ahh uh iiih aah ohhh iiih uuuh uuh uuuh eeh,2
ooh ehh ooh oh ohh eeeh iiih ohh aaah ih ehh uhhh uhhh ahhh ehhh ooh ehh iih ahhh iih aaah ah ohh eeh uuuh eh uh,0
ah uhh uh uuuh ooh ihh iih ahh iih aaah ohhh ihh aaah eh uuuh ih ahhh uhhh ohh ooh uuuh ohhh aaah,0
ih ihhh ahhh oh ooh ooh ih ehh oooh uuuh oh ohh eeeh ih uhh ohh ih uh uh eeeh ohh iih aah uh ehh eeh uhhh uhh,2
oooh eh uhhh ahh ahh oh aah uhh ah eeh uuuh aaah ahh ihhh uhh aaah ehh ahhh uhhh uhhh ah uhhh ehhh,0
uuuh eh ahh ohh ih eh oooh uh eeeh ih oh ahh ehhh oooh uuuh eeeh ehhh ih ih iiih eeh uuuh uuuh uh,2
ahhh ahh ahh ihhh iiih ehhh aah uuh uh eh ahh ihh eeeh ohh uuuh uuuh oh ihhh eeh aah ooh,2
aaah ahh uuh ih ehh ahhh ooh aah uuh ihh oooh uh iih aah uhh iiih ehh ohh eeeh ooh ehhh ehh oh,2
uuh ehhh oh iiih uhh ohhh eeeh ihh uuuh uhhh uuuh ahhh oh ohh ehh eh uhhh iiih,0
iih ohhh ihh ooh uuuh ehh iih ohhh oh ihhh ehhh eh oooh,0
ah iih oh ah iih ihhh uuuh ehhh aaah ehhh ihh ihh,0
ah oooh aaah uuh uuuh aaah ehhh uh ah oooh iih eh eh ih iih aah ehh ih eeh ehhh eh uuh,0
ehhh iiih ah uuh uhhh uhhh ahh uuuh ehh ih oh ihh ahhh aaah ehh ehhh ehhh aaah uhhh ihhh ah uh ohh uuuh eeh,0
eeeh ohhh ooh eeh ah oooh uhh uuh uhh uhhh eeh,1
ahh ehh oh ihhh uh,1
iiih ih uhhh eeh ehhh ohhh uuh iih uh iih,0
ehhh aaah ah oooh iih ihh ih iih oooh aaah ih ihhh ah oooh uuuh eeeh,0
oh uuuh ah ohhh uuh,0
ahhh ohhh ihhh uhhh ihh ehh ohhh ih eeh,0
ehh eeeh iih ehh ehh ehh uuh eeh uhhh oh aaah oh ihhh aaah ihh ahhh oooh,0
ehhh ahhh uhhh aah iiih ihh uuh ih eh uuuh uh ah ehh ah ohh ihhh ihh ihh,0
iih ooh ah ehhh ahh ihh iiih eeh eeh uuuh ih uuuh ehhh oh ehhh ah uhhh iiih,0
ihhh ah ehhh uuh ihhh iih uuuh ehh ehh eeeh eeeh ihh uhh ooh ooh uuuh uhhh eh aaah uhh aah ehhh ehh iiih oooh uuh uhhh,2
ih oooh ohhh ooh ah ehh ohh iiih ehhh ihh ehh,1
ahh eeeh iiih ihhh uh eeh aaah ohh ehhh ah ihhh ih iiih ehh,2
aah ahh oooh uh aah uuuh iih iih ahh uhh uuuh aah ah ehhh oooh ihh uhh ohh oooh eh ihhh uh eh ehh ehhh uuuh aaah aaah ih uhh,1
aah ihh ahh uhhh ih ohhh ih iiih ohhh eeh aah uhhh ehhh uhh ooh eeeh ahhh ohh ooh eeh,2
oooh iiih iiih ehhh ahhh,2
ihhh oooh iiih uuuh uhh ah ohhh uhhh ih iih aaah oh eh aah ah ahhh eeeh,0
iih ahhh aaah ah uhh iih ihh uhh uuh ihhh oooh ihhh ihh ehhh ehhh eeh,0
ohhh uh iiih uuuh ooh eeh,0
iih iih ah oooh uuuh ihhh ohhh uuuh ih oh ahh ehh uhhh uhh ahh ohh aah uuuh iiih oooh uhhh ohhh eeeh ohh aah eeeh ohhh,0
ihh ohhh uhhh ihh ih iih ehh eeh eeh ihh ehh ohhh,0
ah uhh oooh ihh ihh aah ehh ohh ah,0
eh ah iih ihhh oh eeh oooh ihhh uuuh,0
ah ahh uuh uuh ooh eh uhhh oh ahhh ahhh aaah uhhh oh,0
uhhh ahh ohh uh oooh oh uuuh eeeh aah uh iiih eh ehh eeeh ahhh ahh uuh,2
eeeh ahh ehhh ooh uuh ehhh uhhh ahhh ahh eeh uh ohh ehh uhh ahhh ohhh iiih oooh uuh uhh eh ahh oh uuuh ehhh,2
ohhh uuuh ehh ihh oh eh uh uuh ih iiih oh eeh aaah iih ehh ah uhhh oooh eeh eh oooh uhhh eeh,0
oh ihhh uuuh eh ehhh oh uuuh iiih eeeh ihhh iih uuuh uhhh ihhh ih ohhh uhhh iiih uhhh aaah ahh ehhh iih aah ih uuh ohh ehhh iih uuh,2
ehh uhhh aah iiih ehh iiih aaah eh aaah ohh ohhh ih ah ehh,0
aaah aah ooh ah ihh uuh uuuh ihhh iih ehhh eeh aah uhh aah ehh aaah uhh,2
aaah oh ooh uh ohh iih ohh ehhh oooh ohhh ah eh ih ohh aah ahh eeeh,2
ehhh oooh eeh iih aah eeh oh uhhh aah ohh ihhh ihh ah oh ehhh ihh,0
ihhh eeeh ohh uhh uhh oh uh aah ih oooh uuh ahh iih eeh eh ahh uhh uhh ohhh uh uhhh aah iiih aah aaah iih ihh,2
ohhh ohh aaah uhhh ihhh eeeh ahhh ohhh,0
uuuh ahhh eh uhh ah iiih ooh oooh iiih eh oooh ohhh ohhh ohhh ihh aah uuuh,0
ahhh ahhh ihhh iiih ahhh uh ehhh ahh ihhh eeh ahhh eeeh ihhh eeh eh ahh ehhh ahh ohhh ehh ihhh eeeh ehhh,2
iih ihh ohh ohh uhhh ohhh eeeh ah ahhh ahh eeeh aah,1
ehhh eeh aah uuuh ihh ohhh uuh,1
uuh ooh uuuh iiih uh uuuh ehhh aaah ehh ohh ahh aaah oh iih uuh ohh iiih ohh ihh uuh eeh ahh ohhh ehh ihhh iiih ih ih,2
ehh uuuh aaah eeeh ihh uuh ihh oooh eeeh aaah ohh uuh uuh,1
eeh eeeh eeeh eeeh ooh oh ohhh eeeh ehhh ah eeh uuuh ohh uuh ooh,2
uuh eeeh ohhh iiih ahhh ihhh eh uuuh uhhh aaah iih,1
uhhh uhh oh eh aaah aah ah aah ehh,1
aah eh eeeh aah uuh ihh eeeh,2
aaah oooh ooh uuuh ohh uuuh eh uhhh ah eh uuuh uuh aaah aaah,0
aaah eeh iiih ahh ihhh iih uh eeh oh ihhh eh aaah eeh eeh ihh uuh uuh ehhh ahh ahhh ih ahhh ah ehh oooh ooh,0
eeeh eh uhhh ih ohhh uhhh uhhh ohhh oooh oh ohhh ahh,0
ehhh ahh aaah eeeh ohh iih aaah ohhh eeh uhh ih oh uhh eeeh iih eh ah,2
ahhh ahhh uhh uh eeh uh ahh ohhh eeeh eeeh ahhh ahh iiih,1
ah iih uh ehhh aaah ihhh uuuh oh ooh ih uhhh ooh ihhh ihh oh oooh uuh uhh ehhh eh ihh ahh eeeh eeeh,2
uhh oh uhh eh ohhh ahh ohh ehh ahh eh oooh ehhh eh eeh uuuh aah uuuh oooh eeeh eeeh ohhh ooh eh ohhh ah,2
uhhh eeeh aah uh ihh eh uh eeh,0
oooh ohh eh eeeh uhh aaah eh ahh ehhh uhh eeh aah ihh iih ehhh aah uhhh ihh ihh aah iih ah uuuh ih eeeh eeeh ehh ih,2
oooh ohhh ahhh ehhh ohh ihhh ahhh ehh ooh eeeh ohhh ihh uhh ohhh ehhh ohhh ihh eeh iih ohh uh uhhh ihhh oh ohh aah oooh uuuh uh eeeh,0
ahhh ahhh ih uhh ih iiih ahhh eh iih ehhh oooh iih uuh ih uuuh ahhh ahhh iih ohh ahh ehhh eh ehh aaah uhhh iih eh ahh oh eeeh,1
oooh ihh aaah eh aah ihh aah iih eh eh iiih uh,1
ohh oooh oooh ohh ah uuuh aah eeeh ihh eh ih ohhh iih ooh iiih eeeh oooh ahhh ah ah,0
uh ihh eeh uuh uhhh uuh,0
uhhh ohhh ihhh eh ooh uhhh oh aah aah eeh aah ah ohhh ooh iiih ohh eh ihh ehhh uh ehh ehh ihhh uuuh uuh ihh,1
ooh ahhh ohhh ahhh eh oh,0
eeh uhhh uh ooh ehhh aah eeh ahhh ahhh iiih eeh,0
aah ihh uuh ihh iiih ohhh ih eeeh iiih aah aah oh iih uhhh eeh uhh ahh ih aaah ihhh oooh ah,2
ah aaah ohh ehh ihhh ohhh ih ohh uhh aah,2
ohhh aah ooh aaah ih ahh oh uuh ihhh uh iiih,2
ih ohhh ehhh ahhh ah aah ooh iiih oh ooh ohh uhhh ihhh ehh uuuh ehh,1
ehh uhhh ehhh eeeh ooh ahh uhh ahhh ihhh uhh ohhh ohh uhhh uhhh uuh eeh ihh eeh aah ahhh ihhh ihhh ih uhhh ahhh eh iiih uuuh ohhh uh,1
ooh ohhh eh ooh ooh uuh ooh eeeh iih iiih eeh uuuh eeeh ihh iih uuh ahhh oh iiih iih ahhh iih ohhh uh,0
uuh iih eeh oooh eeeh ohh ehhh oooh ehh uhhh ih eeh ahh iiih oooh ih,1
eeh ehhh aah ehhh oh ih uhhh aaah ahhh ih ooh uh uhhh uhhh eeh ah ohh uhhh aah ahh aaah iih uh,0
eeeh eh iih ehhh ih ehhh uhhh uhhh uuh iiih uhh oh aaah ihhh aaah eeh,2
aah ehh uhh uhh uhh iiih eeeh uuuh iiih iih uhh ohh uuh ah ihhh aaah aah aaah ihhh iih ahhh ah ooh,2
aah iiih ehhh eeeh oh ihh ehhh ooh oooh eeeh ih ihh uuuh uuuh ih ooh aah iiih uuh ohh eeh uhhh oh iiih ah ah ohhh ehh uhhh eeeh,2
ooh ahh ahh uhh aah ihhh eeh eh ohh oooh aaah iih uh ohh ihh ah oooh,2
ohh ah ehh uuuh iiih aaah ehh ah ihhh eeeh eeh oh ihh uuuh iih eeh ehhh ihhh ahh ohhh,0
aah uhhh uuuh ihh iiih ih aaah aaah aaah ahh oh aaah ihh uuuh oooh eeh uhh ihhh uuh,0
ih iiih ihh uh ihhh ehhh uuh iiih ohhh uhhh ohhh oh ohhh aaah eeh iiih iih uhh ih ihh uh,0
ih aah ehhh eh ihh ohh ahhh eh iiih ah oh ehh ahhh uhhh aah ihhh uh ehh ehh ohhh uuh uhh oooh eeeh ehhh iih aah ohhh ooh iih,1
ah ohh uuuh uh uhhh oh ohhh uuuh ehh uh ooh uhhh iiih ahh aah ohh ihh ahhh ahh oooh ooh,0
uuh eeeh eh ehh ahh ohhh ehh,2
ihh ooh eh ah ehhh eeh uuh oooh iih ohhh uhh aah eeeh eh aaah ohh uuuh ooh aaah oh eeeh ihh,1
oooh ihhh ohhh oh eh ehh uuh ohhh ih aah iih eh uh uuuh oh uhh,0
aaah aah ooh ooh uhhh uuh ohhh iiih eh aaah oh ohh aaah iiih,2
ahhh uh aah eeeh ahhh ihhh,1
ehh uuuh ih uh ihhh ohh oh uuh uhhh ah aaah iih,0
ehhh uuuh uuh iiih ahhh eh aaah oh ehhh ahh ehhh ehh uuuh ehhh iih oooh aah aaah oooh ehh ohh oh,0
iiih oh iih aaah eh ohh uhh aaah ooh ooh uh ihh uhh ehhh ih ahh uuuh ihhh uuh,2
ih iih ah ahhh aah ehh iiih ehh aah uhh eh uuh eh eh,2
uuuh ahh ahh ih ihhh uuuh,2
ohhh uuh oooh ahh ahhh uh eeh eh iih ihhh ehh uuh ah iiih oooh uh ihh ahhh uh eeh ohhh ahhh ohhh oh aaah,0
uhhh uhhh ih oooh iih ehh ehhh uuuh ihh eh ohh iiih ohh aaah ehh eeeh ihhh ehhh uhhh uhh ooh iih ah eeeh ah,1
ahh ihh uh eeeh ahh uuuh ahh eh uhhh uh eeeh ihhh ehh ahhh aaah ohhh eeh ehhh eh uhhh iih ahh uh oooh aaah eh eh,0
ahhh aah oooh eeeh ih iiih ahhh uuuh eh ihh aah oh oooh iih uhhh ohh ih aah oooh uhh eeeh ooh iiih ehh oooh ehhh uuuh ohh ah ehh,1
eeh aaah uhhh ih uuuh ihhh eeh ih eeeh ah ahh uh ohh ihh ehh eeh ehhh,0
eeh ih ooh ohhh ihh iih eeeh ihh,0
ah ehhh ih iih eeh oh ehh uhhh ihh ohh oooh,0
ah eeh uhhh uh uuuh uh uhh ohhh ahh iiih ah ihhh aaah aah ohh uhhh oh uuuh ohhh aah uh,0
ihhh uhhh iih uhhh ahhh ah uhh iih eeh ahh ahh iih ohh ahh uuh uh eeh ah ohh uuh aaah eeh ahhh eh,0
ahh ah aah ah ihh ohh eeeh ohhh ah iiih ih uhhh iih eeeh uhhh uuuh ah ehh ahh eeh ehh uuh aah ihh ihh ihhh,0
ohh ih aah eh eeeh iih uuuh uuh uh ehh ooh ihh oh uh oh eeh eh oh aaah ah eeeh aah aaah ohh oooh uuh eeh,0
aaah ahhh aaah iih iiih ahhh,0
ih eeeh aaah ihhh aah uhhh ehh ihh ooh aah ih uuuh uuuh ihh ahh aah uuh ohhh uh oooh,1
eeh uhh uh aaah iih eeeh aaah aah,0
aaah uuh ehh ohh iiih ahhh iih iiih ohhh ahhh eh aaah ih ohhh oh eh aah ihh ihh ohhh eeeh,0
oh eeeh ahh ohhh ihh ihh ihh oh oooh ahh eeh uh ah eh eeeh eeh ahh ehh ohhh,0
ah uuh ehh ohh eh eeeh aaah uhhh uuuh aah eh ehh iih uuuh oh uhh ah ehh aaah oooh iih aaah eh ah eh aaah,0
eh ah uhh uh uuuh aah ahhh uh ihh uuh uhhh,0
eeeh uhh aah ih ahhh eeh ooh ihhh iih,2
ihh uhh ihhh oooh ah eeh eh ooh ooh eeeh,2
eeh ah eh ohhh eeh ihhh iih uhh uhh aah eeeh iiih eeeh oooh ihhh eh iiih ahh ohh ah ihh oooh uuuh ehh eeeh eeeh,2
uhh eeeh uhhh uuuh iiih ehhh uuh ooh iiih eeh uhhh eh uuh ehh iih eeh aaah ih uh ohhh ohh aaah ooh eh oh ihhh iih ahh aah,2
oooh ih ehh ahh uhhh eeh oooh ahhh uhhh oh uhhh uhhh ohhh uhhh oh iiih uhh ihh uuuh ah ohh aaah,0
iih ehhh iiih ehhh aaah aah uuuh uuuh ooh ah eh eeeh ehhh ih ehhh iih ihhh ihh ihh ahh iiih iiih oh,2
uh ohh ehh aaah iih eh ehh ahh ohh ihh ehhh aah ehh ohh ih ah ah uuh ihhh iiih ooh ohhh eeh eeeh,2
ehh ohh ah ahhh oh iiih eeeh uuh uhhh ehhh ehhh aaah iiih ih oooh aaah ohh aah ihh ihh oooh,1
ahh uh ih uhh ih eeeh ehhh uh,2
ahh ahhh iiih ehhh ohh eeeh ah ihhh ehh ooh ah iih uh uh ih ooh ahhh uhhh ehhh aah ehh eeeh,2
ehhh ehhh uhh ooh ohh ooh uuh iih ih ahh ooh ooh ihh aah eeeh ihh ehhh iiih eeh oh aah aaah ehhh uuuh oooh ohh eeeh aah aaah oh,2
iiih ihh oooh eeh aaah ehh aah oh aah oooh iiih aah uuuh iih,0
ih eeeh ih ih ohh uh uhhh eeh aaah ihhh,2
uuuh uh ih ooh ihh ahh uhhh,1
uhhh uhh ihh uh ooh eeeh ih ah uh eeeh ooh ah ooh ihhh eeh ahh oh iih,1
uh oh ehhh ihhh ohh iiih eeh ah uuh oooh uuh ihh ihhh ehhh uuuh uh uhh uhhh aaah ehhh ahhh ihh ihhh,1
aaah iih uhh ooh aah ooh aaah eh uh eh oooh eh eh ah,2
uh ahh ehh ihhh ooh uuh oooh eeh,1
eeeh uh ohhh ahhh uuuh,0
uh ih ehh eeeh ihhh aaah ah ihh eeeh ihhh ehh oh eeeh uh uh eeh uhh eeeh ih eh uuuh ohh,1
uhhh uh iih ehh eh ahh uuh eh ah uhhh ohh uuh uuh ohh aah,2
iih ah ih ooh iih oooh ahh uhhh aaah oooh oooh uhhh ohhh ih,0
ooh eeh eh ahhh ooh uhhh ihhh oooh ahh uhh eeeh ih iih,2
eeh ohh ihh ehhh ah eeeh ah ihh uuuh uhh uh ihhh ahh aah uhhh aah eeeh ih ah iiih,2
oh iiih iiih aaah eh uuuh ihh ahhh uhh eh ih uuh ah oooh ih eeeh ihhh uuuh aaah uuh aaah uuh uuh eh uuh uh aah eeeh ahh,2
ihh eeeh ahhh ooh eeeh eh ohhh uh ih ah ihhh aaah aah,2
ihh ohh uhh ih ah ehhh ih ooh oh aaah eh iiih eeeh ih iih ihh ihh uhh ehh ihh iiih aah ih ehhh ohhh uhh ehh ohhh,2
iih ihh ihhh iiih ooh iiih ooh ihh ihh uuh aaah ohh oooh oooh ihhh ih ehh ah eh oooh uuuh iiih ohh,2
iiih uuuh eeh uh ahh ehh ahhh ih aah uhhh ehh ahh ah ahh ih aah ahhh uh eeeh ahhh ohh ooh eeh ooh ohhh oh ohh eh uhhh ohhh,0
oh ih aah uh ah uh uuuh uhhh ehhh uuh eeeh uhhh aah ooh aah ihhh ehhh ihhh aaah ahh eeh uuuh uhh oh,2
ih ohh ahh iih ih oh ah uh eeh ohhh iih ihh uh ihh eh ehhh,0
uuuh uhhh ooh ih ohh ah oh uuh ohh ooh aah eeeh oh oooh ahhh ehhh ih ehh ihhh ooh aaah aah uuuh aaah uuh ohhh eeh,2
ihh ihhh uh ohhh ahhh oooh uh uh aaah ihh,0
uuuh uh ahh aah oooh ahhh aah aah eeh ihhh ohhh aah oooh ahhh eh ooh eeh ahhh iih ooh ih,1
ooh eh ohhh iih uhhh ohhh eeh uhh ehhh ohh iih ih iih,1
ooh uhhh eeeh eeeh ehh ehh uh ihhh oh ehh ehh eeeh ihh uhhh ehhh oooh aah,0
ohhh oooh uhh eh aah ihhh aaah ohh uhh ahhh uuuh eeh oooh ih ah uhhh ohh,1
uuuh uuuh eeeh ooh oooh aaah aaah ah iih iiih ihhh eh uuuh ohhh ooh oooh aah ih ehh oh ehhh uhh ah aah eeh oooh eh ehhh iiih iih,0
oooh oooh uuuh ehhh uh ohhh ihh aah ih ooh ehh oooh ooh,0
ihh ahh iiih iih ihh aah ahh uuuh ehh ehhh,1
eh aaah ihhh aah ah uuh iih ah ih uhh uhhh aah,2
ohhh eeh ahh uuh ihh uhh uh oh ahhh ooh aah ih uhhh uh ih uh eeh,0
ih ah ahhh ahh ohh ahhh eeh uuh ohhh uuuh oooh uuuh aaah ehhh oooh uh ohhh eh uhhh ahhh ih eeeh uhhh eeeh,0
ooh ooh oh uuh ah ah ihh ehhh uhh eeh uh ooh uuuh oooh oh eh ahhh iiih ohhh ihh uhhh iiih eh oh oooh aah aah uuh ihhh ooh,1
uhh ooh oh aah ooh ihh eeeh ehhh ehh iiih ohh,2
oooh ihh ah uuh oh aaah,0
iih uhhh aaah iiih ahh ohhh ahhh oh aaah uhhh iiih oooh ahh uh aaah ooh aaah oooh uuh aaah ehh aaah eh uhhh uhh ohh eh eeh ihh,0
oooh ihhh uh uhh ihh aaah aah iiih iih ehh iiih,1
ahh aaah eeh ehh ih ihhh aah eeeh iih uuuh uh,1
ih ahh ohhh aah oh ehhh uh ihh ih ohh ahh iih uuh uuuh uuuh ehhh uuuh eh ehhh uuh eeeh uh ihhh ahhh ooh eeeh uuh iih,2
ihhh iiih ohhh uuuh oooh ooh ooh ihhh uuh eeh iiih aaah ohhh ih eeeh eeeh ih ehh,2
eh aaah uhh uhhh ah ihhh ahhh oh oooh uuuh uuuh ooh eeh ih eeh eeh ohh uuuh ih eeh iiih ehhh eeh ehhh uuuh uhh eeh ehh eeh eh,0
ah iih uuh ohh iih ohh uuuh oooh uhh ihh iiih iiih eeh eeeh,1
uh ohh oooh ihh iiih ihh iih aaah eh ahh ahh eeh ohhh,0
eh ih ehhh uhh eeh ehh iih ah aah oh ohhh ohhh eeeh uuh,1
ehhh oh eeeh eh uhhh uh ihhh ooh ihhh iih ehhh eh uuh aah uhhh eh,2
ahh eeeh ohhh eh ehh iih ohh iiih uuuh uuuh ooh aaah uuuh ehh eeh eeh uhhh oooh ah,0
aah oooh ohhh ooh ehh ohhh,0
uhh aaah eh ah uh,1
uuh ih ihhh ehh ahhh ihhh ehhh eeeh ooh ah,2
ehhh ah eeh uh iih uhhh uh ah uhhh aah eeh uuh iiih ih eh uh aaah eh,0
oh ahh ehhh uhh ohhh ohh iiih oooh eeeh eeeh eeeh uuuh ohh ih ahhh ohh eeh eeeh oooh ah ohhh aah eeeh ahh uhhh aah ihh ih ahhh,2
ahh uuh iih oooh ah ohh uhh uuh ehh eeh ihh eeeh aaah uhh eeh ah eh ih,1
uuuh uuuh aah ehhh uhh,2
eh eh ah ihhh ehh ooh ahh ihh ihhh aah iih ihh eh oh ahh aah uuuh eeeh iih uuuh ohhh ooh ehh eeeh aah,2
uuh eeeh aaah ehh uuh oh eeeh iih aah uuh aah ohh eeh aaah ih eh iih,2
aaah uuuh eeh aaah eeeh ah uhh,0
uhhh ihh ooh eeeh uuh uhhh ohhh ihhh iih ih ihhh ahh ah ah iiih eeeh aah uuh eeeh eeeh eeeh ihhh ohhh eeh uuh ihhh ihh eeeh uuuh,2
uh aah ahh eeh ehh ohhh iiih aah ihhh ah eeeh ihhh aaah aaah oh uh eh ooh iih,1
uh ehh eeh ih ihh uuh iih ahhh iih ihh uuh iiih ah uhhh uuh eh ehhh iih aaah uuuh oooh,0
aah ih ooh ih ooh ahh uhh ehhh ooh eh ehhh iiih ihh ohhh ihhh ooh,2
aah eeh ihhh iih ohh ohh ihh aah ah ihh uhhh ehhh ehhh ehh ahhh uhhh ehhh ahh ah eeh ihhh ahh uhh uhh,2
uhhh eh ihhh ahhh aaah ihh eeh,0
ohh eeh eeh eeeh uh ah eh oh ehh ooh uhhh ohhh eh oh eeeh ih iiih ohh ahhh ih iih uhh iih ahhh ah eeeh ahhh iih,0
ihhh ehh ahhh uhhh uuh uuuh ihhh uh,0
eeh ahhh ihh ehh ehhh ihh uh eeh oooh ihhh ihh uh,0
aaah ehh ihh eh uhh ahh uuh ehhh eeh ihhh iiih,2
ahhh uhhh eeh iiih uhhh ahh ehh ehh aah ohhh ehh ihh uuh iih ihhh uuh ahh oooh ihh ohhh uhhh ohh aaah oh ehhh oooh,0
ehhh uhh uhhh ehhh uh ehh uuuh oooh ahhh eeh ooh uuh ehh oooh ahh ehh eh,0
iih ohhh ohhh iih oh ehh uuuh uuh aah oh uuh ahhh uuuh eh eeh iih uh ehh aaah ohhh ihh ooh ooh ihhh ihh ih uh uuuh ih aah,0
uhhh ihhh oh ah ahhh aah ehhh ohhh eeeh ehhh ahhh oh ehh ehhh ahh oooh uuh uh ehhh ahhh,0
ehh uuh aaah iih uhh ih oh ehhh,1
ah iiih uhhh ohh iih ohhh oh eeh ihh uuuh ehh ehh ehh uuh ehh ihhh ehhh aaah eh uhh ih ehh iih oooh eeh uhhh uuh ihh uuh eh,0
iih ahh eh ihhh eh ehhh ohhh ahhh eeh oh oh ihh uhh oooh ihh ihhh,0
ah uhh uuh uuh aah ehhh ohhh ihhh uh oh oh ooh oh uhh ah eeh iiih ohh ohh ohhh ah ohhh ehhh ehh iiih,2
ih ooh uuh oooh iih ih ehh oh aah eeh ehh ih eh iiih,2
uh ihhh ahh iiih ohhh ah oooh,1
iiih ooh ih ahh ahhh eh,2
ihh iih iih ehhh eh uuuh aaah iiih ahh,1
iiih ehhh ihhh uhh ahhh oooh eh ihhh aah uhhh eeh ahh aaah ahhh eeh ih oh eeh oooh ihhh uuh uuuh iih oh ehh uuuh uuuh,0
oooh uhh uuuh ihh uh uuh,0
eh ihh ehhh eeeh ih uuh oooh eeh iiih ihhh iih uhhh ehhh ehh iih,2
ohh ooh ihh aah uuh ahh ooh oooh ehhh uh ihhh ihhh ihhh uhh uuh oooh ehh uhh uuh uhh aah eeeh aaah ihhh ihh,2
ih uh ohh ihh iiih ihhh eh oh eh ahh ah ehh eeh eeeh ihhh iih ohhh,2
ahhh eeeh ihh iih eh ihhh uuuh aah eeeh ihhh ehh ehh ohhh ohh oooh eeh ah eh eeeh oh aaah uh uhh iiih ehhh ih eh,2
ihh eeh ooh iiih ihhh uhh uh uuuh aah eeh oooh oooh ah aaah ohh uuh uuuh ooh oh uuuh eeeh,0
ehh eh ih uhhh oh oh uuuh ohh,0
ehh aaah uh aah ahhh iiih ih uuuh iih eeeh ahh uh ihh eeeh ahh uuh uhhh eeh aah eeh aah iih aaah ahhh,0
eh ehhh uuuh uh uuuh uuh iih uuuh iiih ooh ahhh eeh ihhh uhhh uhhh ohh ehh ohhh ihhh aaah ahh ehhh ih oh eh eeeh,1
aaah aaah ohhh uuh ooh ahhh uhhh eeeh uhhh ih oooh ihhh ooh ihh uhhh iiih ehhh eeh uh eeh ehhh ahh,0
uuh iih ihh ahh uuh ohhh uuuh eh,1
uuuh eeh iiih ahh aaah ih ooh eeh uhh ehh ihh uuh aah ohhh eeh eh ehh eeeh uh ahh ehh ihh,0
ooh ohh ih uh ahhh aah oh ohhh uhh uh uhhh ih ahh aaah iiih eeh uuuh uhhh uuh ooh oooh ihh ih oooh,0
uhh ehh ooh ihhh ahhh uhh aaah aaah aah uuuh ooh uuh ahhh uh ih uuuh uh ihhh uhh iiih ahhh eh oooh ehhh eeh,2
eeeh eh ohh eh uhhh,2
ihh ah iiih uhhh ihh uh ih,0
eeh ihh oooh uh uhhh ahhh,0
ehhh ihh ihh ohhh ohhh ehhh,0
ihhh eeh uuh uh uh eeh aah uuuh ooh ehh uhh uhh ih aaah ih ehhh uh iih,1
ahh ahh ah iiih ehhh ehh ohh,2
ahh ihhh ooh ahh uhh uuh uuuh iih uuuh ohhh ihh uh uhh uuuh ohh iiih uhh ooh,2
uuh ahh aaah ahhh eh eeh aah uhhh uhh aah uhh ohh iiih ahh eeh,2
eeh uuh aaah ehh aah eeeh ahhh ohhh uhh uhhh uuuh eeeh ih eeh uhhh uuh aaah ahh ooh uuh ahh,2
aaah iiih ohh ohh uuuh ih ah uuuh,1
ih ooh aaah ohhh ihhh uhhh ah aah,1
aah ih ahhh ah ih eh ah ooh ohh ohh ehhh oooh aah ah aah ohh uuuh uh iiih eeh uuuh ih iiih oooh,2
ehh aah eh ohh oh eeh iih ihh ohhh eeeh iih,0
oh ohh eeh uuuh uh eh aaah iiih ohhh ahhh iih oooh eh aaah ihh ehhh ohhh ih oh ooh aaah uhh ohhh uhhh,0
uuuh eh uh ohh uhh uhh uuuh ih aaah uuh aah aaah ahhh aaah uuh ahh ohh ehh ohhh uhhh,1
eeh aah aaah ah eeeh,1
aah ehhh ahhh ah ah uuh ihh uh oooh uuuh ah aah uhh uuh eeeh ihhh ohh ohh ih ooh eeh eeeh oooh ahh ohhh iiih eeeh uhhh,2
ehh ah ihh uhhh uhhh oooh uuuh eh ihhh ah uuh ihhh ah eeeh uh,0
iih ooh oh oh eeh uh oooh ih ehh ihh ehhh uuuh ohhh eh iih ohhh iiih uh,0
ihh eeeh iih eeh iiih ih ih aah uh,2
uhhh aaah eeh ohhh ih ihhh uuh ihh eeeh ohhh ihh ehh uuuh iih ah ohh,0
eh ohh ohhh aah eeeh aaah uhh iih ooh uuh oh ih,2
ihh eeh eeh ehh ihh oooh eh uhh iih ihhh aaah ahh aah eeeh ohh uuuh ahhh ahhh eh uhh ohhh ohhh aah ihh ahh ooh,0
ihhh ehh ehh ih iih ihh oh uhh iiih uhh iih eeh ihh uuh ih ehhh uuuh ohhh uuuh aaah ohh ehhh aah,1
eeeh ehh uuh oh eh aah uh uuh eh ehh eh uuh eh ehhh ih ahh ehh eeh ahhh uhhh ahh ahhh ahhh oooh uhh uh uhhh ah,1
ooh iiih eh aaah oooh eh ooh ohh ehhh ehhh uh ah aah ah eeeh uuh ahh ihh eeh oooh ahh ehh uuh eeh uuuh uuh iiih oh uhhh,2
ehh oooh ohhh iiih ohhh ih uhhh iih ahhh eeeh ohh oooh ahhh uhhh ohhh ahh uhh iiih eh ahh,0
uuh uhh aaah uhhh uuuh eeh aaah iiih ihhh eh uuuh ahhh uhhh ahhh ah oooh aah ahh ohh ahhh eh uuh ahh ooh ehhh ahhh uhh iiih,2
ehhh iih ohhh iiih uuuh oh ihh ehh uhhh ih oh,0
ahh aah uh eeeh eeh ihh,1
ehhh ihh iiih iih eeh oh ohhh uhh uh ahhh uuh uh oooh oh ih ahhh eeeh ohhh uh ih ehh uh,0
ooh ohhh oh aaah ahhh eh ahhh uuuh ahh iiih ahhh ohh iiih iih uhh ihhh ohhh uhh,1
oh ooh eh uuuh uhhh ah uuuh ihh uuuh ahhh,0
oooh oooh uuh ihh uuuh ih eeeh ahh ahh aah uhhh uhhh ahhh iiih uhhh,1
ooh eeh uhhh ihh ooh ooh ihhh aah oh,2
ah oooh ooh eeeh eeeh aaah aaah eh ahh ehhh aah eeh ehhh ohhh ahhh,2
oooh ohhh uuuh uhhh ehhh ahhh ihhh uhh ahhh ahh uuh eeeh aah uh oooh uhhh uhhh ohhh ahh aah,0
iiih ih ihh uhh iih oooh uhh aaah eeeh uh ehh ohh,1
eeeh ooh uhhh aaah ehhh uhhh eh eeeh iih iih ahhh oooh uh ohhh oh eeeh,0
uuuh oooh ehh ah iiih ahhh ahh aah,0
aah ehhh eh uuuh ihhh ihh oooh,2
uhh aaah ih aah oooh ahhh eeeh ahhh eeeh iiih,2
