kalimat,status
ohhh eh ooh ih ooh oh iiih ooh aaah ohhh aah eeeh aah uh ehhh,2
iih ahhh aah ahh oh ahh ih ihhh,2
ahh eh uhh iih ohhh eh eh uhh ohhh eeh ehhh uuh oh uuh aaah uuuh uh ohhh ehhh ohhh ah ohhh uh ahhh uuuh oh ooh,0
ih aaah oooh ihh aah eeh uhhh oooh ahh aah oooh uhhh eh ah ihhh ihh ih ahhh eeeh ohh,0
oooh eeeh oooh iih ooh oh uhh ah uuuh ooh iiih ih iiih ahh uuuh iiih ehh uuuh oooh ooh uhhh ehh ehhh uuh iih ehh ihhh ih oh,1
eeh ahh ohh uuuh ihhh ihh uh ooh uhhh,1
ehh ahh uuuh ahh iiih uuuh ahhh ehhh iiih uhhh uuuh ohhh aaah eeeh eeeh ohh eeeh,2
eeh iih oh uh ahh aaah ooh eh ahh ohhh ahh eh ahhh ooh eeh uh uuuh ooh ehh aah oh ahh eeeh,1
uhhh iiih ohh uhhh oooh ehhh ahhh ah uhh iih uh ih uuh ehhh eeeh ihhh oh ah ehh ehh uh oooh uhhh ah,0
oh uuh ah uuuh eeeh ahh ehhh aaah ooh iih ohhh ihhh eh,2
ahhh ah eh ehh ehh uhh ihh iih ooh uhh ihh ooh iiih uhh ih ihhh aaah eeh oh ehh,0
ah ehh ah ohhh ihhh ohhh ohh oooh ohhh ooh ihh,0
uuuh ihhh uh ahhh uuuh uuh oh iiih ihhh ahhh uuuh uuuh iih ohhh ohh uuuh iiih ohhh eeh ohhh aaah oooh ah eeeh ehhh iih uuuh uhhh eeh,0
ahhh aaah ehh ehh ohhh oooh ih ooh ahh ooh oh ihhh ehhh aah ohh ah oooh ih ehhh oooh aaah uhhh ehhh ih oooh ih ahhh uhh ohh ooh,2
oh eeh eeeh ihh eh uhh iih uhhh ahh eh iiih oh ihh uhh uh ohh ehh uuuh eh iiih ahhh eeh ohh ihhh uhh ehh ah,1
ahhh uuuh uhh ihhh oh ihhh aaah uhh ihh iih ohh ohh eeh eeh ohh ehhh uhh ehh ohh iih ohh aah ooh iiih eeeh aah ah ohh iih ohh,2
ooh ih ihh uuuh ohh eeeh iiih uh eh oooh uhh ohh aah uuuh oh eh ahh ah,2
ah iiih ehhh aaah ihhh ehhh iih oooh uuuh iiih uh oh oh uhh,0
uuh uhh ih ih aah iiih uhh ehh oh eeh uuuh ihh ehhh uhhh ah iih uuh,2
eeeh eeh oh ih ihh uhhh oh uuh ahh aaah uuh oooh eh uh uh ih uhh ihhh uuuh ohhh aaah oooh iiih iiih,0
uhh ohhh ehh ih iih eeeh eh uuuh ahhh uuuh eh ohhh uuuh ohh ahhh ohhh ohh ehh uhh uuh eeeh eeeh eeh ohh,1
eeeh iiih ah ih ohhh eh ahh uhhh eh eeeh eeh aaah ehh oh ihh ahh uhh aaah,1
ahhh ehhh ehh aah eeeh ohh uh uuuh uuuh ihhh uhhh ahh ehhh,2
aah uhh uuuh uuh ohhh uh ahh ahhh ahhh uhhh uhhh uh iiih ooh ooh eeh oooh aah iih ooh ehhh ohh ah aaah,0
ahhh ehhh iiih ohhh ohh eeeh ehh uhh ihh,2
aaah ooh uuh uh uhhh oooh ihhh eeeh oh uhhh ohh iih ahhh ihh aah aah uhh uhhh ihhh uhhh ahh ooh ehhh uh,1
iiih ooh uuh ihh eeeh ehhh oh eh uuh iih iih,2
aah ooh ohhh aaah iiih,2
ohhh ehhh uh eh aah ohhh ehhh uuh oh uuuh uuh aah ohh aaah ih,2
aah ehhh uhh aah iiih,2
oooh uh eeh uhhh uuuh uuuh ooh uhh eeeh oh ihh ih eeeh eh uuh uhhh ahh ihh oh ih ih ihhh ah ah uh ihhh,0
uuh eeeh ih ohhh aaah uh ah ih iiih ahhh uuh oh aah iiih eh,2
ohhh oh uuh aah iih uhh aaah ahhh ihh ihh uh ohhh ahh oooh ooh iih ehh ooh ehhh ehh,0
ihhh eeh ohhh eh ooh ohhh ooh ah ah ihhh uhh oh ahhh ahh uuh ahh eeeh ihhh uuh uuh oooh ih ah,2
ehhh eeh ehhh ihh uhh aaah uhh iiih uhh ooh aaah ehh aaah uuh ohhh uh aaah eeh ohh,1
ihhh iih ihh iiih uuh,2
ihhh iiih ihhh ih ihh ahh ohhh iiih ohh ihh aaah ooh eeeh ohhh ihhh ihh iiih uh uhh ahh ihh ehh iiih uuuh uh aah ahh ahhh eeh uuuh,2
ah ih ehhh ohh ahhh uh ihh ah aaah uhhh ih eeeh uuuh ihh iiih oh aaah eh ohh,0
ohh ihh aah ihh ihh aah uuh uhh eeeh ihh uh ahhh ohh ohhh ohhh aaah ooh uuh ohhh uhh ehhh eeeh ohh eeeh,2
ehhh uhh iih ihhh uuuh ahh uh iiih uuh ooh eeh ehhh ihh ooh ah ohhh ehhh,2
ihhh ohh ooh eeeh ooh eeeh ah ahhh eeh uhh uhh ahhh ohhh ohhh ah aaah ohh ihhh uhhh uuuh iih ah ehhh ehhh uuh ihhh uuh ah iih uuh,2
ihhh ohh ihhh eh ehh eh ihh iih ohh ohhh aaah eeeh ehhh ahhh ooh,2
ohhh ah ihh ah uhh ehhh uh eeeh ihh ehhh ahh ihh eeh eh oooh ih eh uhh eeeh aah ehh ah ihh ohh,1
uhhh ah ehh ahhh ehhh ahh ahh eeeh oh aah iih ahhh ohh ihhh ihhh ahh eeh oh aaah ah,0
ohh uhh oh ahhh uuuh eeeh ihh uh uhhh ihh uuh uhhh ehhh ihhh ih aah uhhh iih,0
eh eeh eeh ihhh aah oh ehh aaah ihh oooh uhhh uh uhhh uhhh ih uuh uhhh eeh ihhh uuh,0
eeh iiih ihh uuh uhhh ooh oooh ahh ehhh aaah eeh,1
ihhh uhhh iih oooh ahhh uh eh ahh eeh ahh uhhh aaah eeeh oh ehhh eeeh oooh uhh uuh ahhh ahh ah ehh,0
ahh eeeh uuh uuh ooh aaah ooh aah ihh aaah uhh ih ohhh uhhh ihhh oh,2
ohhh ooh uuuh oooh ohhh iih uhh uhhh iih oooh ihhh uhh ah ihh ehh eeeh oooh,0
oh aaah aah eeh uuh ihhh eeeh uhh ooh uuuh uh ehhh,2
ah eeeh oh ihhh iiih uuh aah iih iiih eh oooh,2
ohh ohhh uuh uhh uuh uhhh ihhh ohh iih oooh ihh iih oh eh ihh oh aah ehhh,1
iiih aah uuuh ehhh aah oooh uuh ooh ah oooh ohh eh ihh ahh ahhh aah oh ihh oooh ihhh aah aaah ahh aaah uhh ohhh oooh ah iiih ohh,2
uhh eeh ooh oh oooh ahhh,0
ehh ehh uuuh iiih uhh ohh ooh ahh aaah ihh ihh ehhh iiih iih eeeh oh eeh uuuh,0
aah ah ahh ihh oooh aah iiih eeeh ehh ah iiih ah aah iih eeh ehh ooh uh ehhh oh uh ahhh,0
aaah ih aah ihh ohh aah aah,2
ahh uhh ooh ahh ooh eh ihh ohh ooh ih ih iiih ih ohh ahh ohh eeh uhhh,2
iih uhh ehh ohhh ahhh uhh aaah ehh ih iih aaah oooh uhhh ooh uh ooh ih aah aaah uhhh eh iih,0
ah ohhh ohhh oh ooh uh eeh aah uh oooh aah uuuh,0
aaah ih uhh eeh ih eh eeeh ihhh eh eeeh iih ah iih iiih,2
uuuh ehh ooh eeh iiih eeh ahhh ihh oh ihhh ah aah oooh ah oh eeh ih oh ohhh oh ehh ahh oooh ah oh ahh ah uhhh ahh ih,0
eh eeeh ihh ih ehhh ihh uhhh ihh ooh eh iiih ihhh uuuh ihhh ihhh ihh ehhh iih ah uuh eeh,2
ih ahhh eh ah aaah aaah ehhh ahhh iih uh ahhh iiih oh ih uhh ooh ahhh ahh ih ihhh uh eeh ehh uh eeeh ooh uhh aaah,0
ehh uhhh ihhh iih iiih aaah iiih oooh iih iiih eeh ahhh uuh ahhh ihh ihh oooh ihh ehh eh oh ohhh ahh ehhh ehh iiih aah uuuh iiih eeh,0
ahh oh ah eeh eh uh ohh ohh oooh uh ohh uhhh ehhh oh ahh ih,1
eeeh iih eeeh ehhh eh ih ah oooh ahhh ehhh eeh ahhh aah ihh ah aaah uh eeeh uhhh ah eh ihh oh iiih uh uuuh ohh oh eh,0
ih eh ooh uhh aah oh uhh,2
uuuh uuh eeeh ehh ohh ihhh oooh ah ahh oooh iih uhh oooh uuh oooh oh uuuh eh eeeh ih ah eeeh ih eeeh uuuh ohh uuh uhh,2
aah aah uh ehhh aaah uhh uhh oh uhhh uhhh,1
ohhh aah ehh iih uuh aaah eh ahh ooh iiih ihhh ohhh ahhh oh oooh uuh ihhh ihh iiih uuh,2
aah eeh iih ehhh ohhh ihhh oh eeeh oh ih eeeh ohh ehh ih ihh iiih,2
ehhh uuuh ihhh uh uh ah ihhh ohh ih ohh ehh ahhh eh ihh uhhh,1
iih uuh oooh ah oooh iih aaah ahhh ah ohhh ihh uuh ahh uhhh aah uuuh ohh ahhh iih,0
ihh eeh ooh eeeh eeh ihh iiih uhh uhhh ohh uuh uh,1
ahh iiih ooh uhhh iiih ah ohh ooh ahhh iih ahhh uuuh ihh ohh uh eeh ohhh,0
ah uuh uuuh oooh uhh ahhh oooh,0
ehhh ehh ah ahhh ihh ohh ahhh ihh ohhh eeh ooh iiih ohh uhhh iiih oooh ehhh uuh ih eeh oooh ehh ooh aah ihhh uhh ih ohh oooh eeeh,2
ihhh eeh uuuh ah eeh ah eeeh eeh eeeh uuh uuh uhhh ohh oooh ahhh eeeh aaah ooh uuh uuuh ehh ih,0
uh uuuh ahhh ehh aah uhhh uhh iiih aaah ooh ih aah,1
uh ihh ihh ohhh aah uuuh uuh ohhh ooh ehh ahh uuh uhhh uh iiih aah ohhh ohhh,0
eeeh uhh ihh uhh iiih uh uhh ehh eeeh aaah eh ah oooh,2
ooh uuuh ehh ihhh ah oh ohh ohhh eh ih ohh uhhh iih ih ohhh oh ehhh ehhh eh iih eeeh iiih ahh ohh eeeh ooh,2
uhh ih uh ooh uh aaah uh ahhh ehh ohhh eh ahh eh aah ahh ah ohhh ah ahh uhh iiih ihh ehh iiih iiih ooh uuh eeeh,2
ih uhhh uh uuuh eeh oh ehh ihh iiih ohh oooh ah ohhh ah ahhh uhh oooh eeh ooh,0
ih uhh ah eh aaah iiih ihh ihhh ahhh iih uuh eeh eeh ih,1
eh iiih iih ihh ehhh oh ih uuuh eh aah uhh ohhh oh uhhh aaah eh eeeh aah ooh ihh ohh ahhh uh ooh ehh uh oooh eeh ahhh uhhh,0
uuuh eeeh ooh ahh ohh eh iih uhhh ah ahh,2
ahhh aaah ahhh eeh uuuh ehhh ahhh ehhh ehhh aaah uhh ihhh uhhh eh ah aah ahh uuh ah ohhh aaah eh ihh,0
ohhh ah iih aaah ahh ihh uuh iih ehhh uh ih uuh iiih uh ohhh ehh iiih eeeh uhhh ah aaah uuh ahhh uuh aaah uh ehh eeh uuh eeeh,0
uh oooh iiih uh ahh ehh oooh,0
oh eeh ahh uhh ehh eeeh,1
uh eeeh ah ih uh uhhh ooh uuuh uh eh,0
ahh iih ehh oooh ehhh ih eeh ohhh uhh uuuh oooh ooh eeeh uuuh uhh ih ooh uuh oh ihhh uuuh oooh ihh ih ohhh eeeh iih ah ahhh ahhh,0
ohh uuh oh uhh ahhh ahhh iiih ohh iiih eeh ehh eh eeeh iiih ih iiih ehh aaah iiih ih ahhh eeeh oh aaah aah uh ehhh ahhh,2
uuh ahh eeh ehhh aaah ah aah iih ehhh ih,2
ehh uh ohh ihhh ihhh,2
uhhh aaah ehh ehhh eeeh ohhh ih aah uhh ah uhh ah iih ehh uuh ehhh aah ehhh ohhh ihh ohh,2
ooh oh oooh ohhh iih ihhh iiih ihhh eeh uh oooh uh ih uuuh,0
ah iih uuuh uuuh ohh,0
uuh ohhh uuuh oooh uuuh oh eeh eeeh ahhh ohhh ihhh iih ehhh aah ihh aah ahhh ooh eeeh ihhh uh iiih eh,1
ah uuuh oh ihh ihh uh oooh ehhh oh iih uhh uuuh ooh,0
ooh ohh oooh eh ohhh aah ahhh uhh ihh uhh,2
ehhh uuh ihh ahhh ihh eh oooh ohh,1
ahhh uhh aah uhhh ohhh ih ih eeh ah ahhh ohhh ih eeh uh iiih ahh ooh uuh eh eeh uuuh uhhh oh ah ah ah iih,0
ihh ah iiih uhh ah iih ihhh ahhh ih iih ohh ihhh ohh ahhh ohh iiih ih oh eeh ooh eh uuuh iih uhhh uuh eeh eeh aaah aah,1
ehh ohh uuh iih eh ihhh ih ehh eeh oooh uuuh oh ehhh ohh ohhh uh eeh eeh ooh,0
aaah ihh aah uuuh eeh uuh iih ooh ahh ahh ahh ihhh ah ihhh ihhh ohh eh ehhh uuh ehhh iih ihhh,2
uuh ihh eh uuh ohhh ahh aaah ohh ih ohh uh eeh ohhh uuuh eeeh eeeh ooh uhh,2
iiih eeh uh uh eh ahhh ahh uuh ahh ih ih ohh oooh uhh uh aaah uh aah ih,2
ehhh ah ihh uh uuh eeh oooh ohhh uhh ahh ehh,0
ihh ahh ihhh eh ahhh eeh eeh ih aah oooh ohhh uuuh ihhh ahhh aaah aaah aaah ah iih aaah ihhh eeeh ooh uhh ohh aaah oooh ohh aah oooh,0
iiih aaah ah aah ih ehh eeeh ohhh aaah aaah eh iiih ahh eh eeeh ehhh uuuh iih aaah ahh ehhh uhhh iiih uhhh eeh ohhh ooh,2
ihh aaah uhhh aaah eeeh uuh iiih ihhh ah,1
ahhh ehhh ehhh eh ehhh aah iiih ah oooh uhh eeeh uhhh oh uh eeh,2
uhh ihhh iih eh ah uhh,2
eeeh ahhh aah iih aaah uuuh uuuh eh ih iih eeh ohh ah eh uuh uhh,1
iih ahhh ah uuh aaah oh oooh uhh ihh oooh iih oooh oh ooh aah,0
iih uhhh eh ah uhhh uuh ehh uuuh ohhh ooh aah eeeh uuuh ahh ooh ehh ah ehhh eeeh ahh uuuh uuh,1
aah uh aaah iiih uuuh aah uhh oooh eeh ahhh ah aah ihh iih aah ah ah ihh ihhh uh uhhh ahhh uhh uuuh ahh,0
ohh ohhh iiih ah uuh uhh eh oooh ahh eeeh aaah oh ehh ahh,2
uhhh uh ahhh ohh ah ehhh uuh iiih ihhh oh iih aah ahhh aaah ihh oooh ah ooh ih ah uuuh ahhh ah ih ehhh ehh uuh ahh ohhh aaah,0
iiih oooh oooh uhhh ah oh ehh ehh uuuh iih ahhh eh aah uh ooh oooh uh ah ooh eh uhh eeeh eeh ahh iih ehh ooh,0
ooh ah uuh eh iiih ihh uhh ohhh ehh ih uh ehh ehh ohh ihh,1
iih eeeh ehh ahhh ohh ehh ihhh iiih ohh oh ooh ohhh uh ehh uhhh ooh eeh aaah eh ehhh uh ahh ehhh ooh aah ooh oooh iiih,2
oooh ohh ohh ih ihhh uhh ehhh oh,2
iiih uhhh ih uuh uuuh ihhh ooh ih uuuh uhh iih ahh eeh ihhh ihhh ohhh iih uuh aaah ihh uuh uh aah iih ihh,2
ooh uuuh ohh ehhh ahhh uhh aah iiih ihh eeeh eh aaah ohhh eeh oooh ohh ohhh ehh uhh iiih eeh ehhh iih ohh,2
eh eeeh aaah ihhh oooh iiih ihh uh eeh ahh ihh ohh ahhh ehhh uuuh oh aah uuuh eh ohh uh ih eeh ih,1
ehh iiih eeeh ohhh uhh oh eh ahh eh uhh ohhh iiih uhh ih uhhh aah ihh eh iiih iih uh eeeh ohh eh uuuh ah ooh ohh ehhh,2
ehh ihhh eeeh aaah ooh uuh oh ahhh uuh eeh ahhh ahhh ihhh aaah oooh ohhh uhhh,0
ohhh ehh ih ihh uhh ahh ohhh eh ah oooh ehh ohhh oooh uuh ohh eeeh uhhh iiih eeeh eh ohhh,1
iiih oooh aaah ahh ohh ih uhhh ih ihh ehh ahh ihh ahhh ehhh eeh ohh ohhh aah ihh ohh ihhh aah ehh uhhh iiih uhh,2
uuuh uh oooh aaah ehh uhh eeeh uh eeh uhhh uhh uh ohh iiih ahhh aaah ihh uhh uuuh ohh ohh,0
ihhh ohh ih ah ooh aah iih aah aaah,2
ah uhhh ooh aaah uhhh uuh uuuh ehhh eh eeh ahhh uh ah aaah aaah ooh ihhh uhhh uhh ih uhhh aah eh,0
ehhh ahh ehhh ohhh ooh ah uuuh ooh ih ehhh eeeh ahh ih uh aaah ahh uuuh ohh ah ehh ehh iiih ahh iiih eh uuuh oh aaah uuuh,2
uuh ah uhhh oooh ooh aah aah ahhh ih uuh iiih iih ahhh iiih ahhh ehh eh aah ih ehh ehh ah,1
iih ehh uh ah iih eeeh ohh ooh ihh ah uuuh eeeh ih ah ahh iih uh,0
uhh ooh ehh ah ehhh ohh oh ahhh ahh ehhh eeh uhhh ahh ehhh ah,2
uh ah ehh iiih uhhh,0
ih eeh iiih uh ihh eeeh oooh aah ahhh ehhh oooh iiih ihh oh eeh ohh eeh ohh uhhh ahh iiih ah uhhh iih iiih uhh uuuh,0
ooh ahhh aah eeeh aah ahh ihhh uhhh eh eeh oh uuh ohhh eh eh uhhh ihhh ooh ihh ooh eeh ah ehhh uh ehh oh iiih oh ihh uhhh,1
oh ahh eh oh ahhh aah uuh oooh ehh iih iih,0
eh ehhh uuuh eh ooh ih ahhh ahh ah eeh,2
uhhh aah aah eeeh oh ooh ihh ahhh uhh uhhh iih ehh ehh uuh,0
ihh iih uuh iih ih eeh ih iih,0
ooh oooh ehh uhhh uuuh eh uh ohh iiih,1
ahh oooh uhh eeeh oh ihhh ohhh ehhh iiih eh ooh ihh uuuh iiih ohhh ehhh,2
oh eeh ihh uuuh aaah ihh eeh uhhh uhh ahh ehhh uuh eh ohh ah,0
ehhh eeeh ehh ih ihhh uhh uh oh eh ihhh iiih ihhh aah iiih,2
iiih eeeh ihh uh ehhh ohhh ah ahh uh uuh iih ihhh uhhh ohhh uh ooh aaah aaah iiih ohh aah eeh aaah eh ih,1
ehh ahh uuuh oh ohhh uhhh iiih ahhh uhhh uh oooh ohhh ihh ohh ih ehhh eeh ehh ohh,0
eh iih ohhh ohh uhh ahh uuh uuh ohh ohhh ihhh oooh eh eeh eeh,2
ohhh ah ehhh ih uuh eeh ihhh,2
ahh ihh ih ohh aaah ah uuh eh iih ehh uhh ooh eeh oooh uuh ohh uuuh ehh ehhh ah ih oh ihh uuuh eeeh aah,1
eeeh oh uhhh ehh ihh ih eeh eeeh ehh,0
ooh uhhh uhh ih ehh eeeh ehhh ihhh uh ehh ohhh ahhh aaah uhhh ehh ehh eh aah eh ah ohh uhhh eeeh oh ehhh,1
ahh ehhh aah eeeh eeh ohh ihh uuh ehh ehh ooh ah,2
ihh ehhh uhh ah ooh ehhh,2
uuh ooh eeh aah eeh uhhh ehhh uhhh eeh aaah eeh ah ooh aaah oooh ehh ih uuh aaah eeh ahhh ahhh ihhh aaah iiih oooh iih ah ahhh,0
ah ehh ihhh uuuh ah ehhh uh ohh aah aaah ooh uuh uhh,2
aaah iiih ih uh uh eh eeeh ihh eeeh ihhh iiih ihh ahhh uuh uhh ooh ahh iih ohh oh iiih uh ahh,2
ahh aah eeeh ooh iiih eh ooh oh oooh ehhh iih ooh eh eeh ehh eh ohhh ooh uuh oooh aaah aaah eeeh uhh eh aaah ohh uhh ehhh iiih,2
ehh ohh ehhh oh uhhh uuuh uuh aaah ohhh ahh ihh ohhh eh,0
aaah ooh aah ahhh aaah ih eeeh ooh ah oh iiih,2
ahhh aah ooh uhhh ahh oooh eh uh ah uhh uh aah aaah ih ohh ooh ihhh ehhh uh ihhh uhh ih ih ohhh uuuh ih,2
iiih aah ehh uhh ooh ih aaah ohhh iiih aaah ih ohhh eeeh ohh ihh uuh uhh aaah ooh ohh uuuh eeeh ooh eeeh ooh oooh ahhh ihh ahh,2
uhh aaah uh uh uhhh,0
eeeh iiih uuh uhhh uhh ihh ohhh,2
aaah ahh oh uh aah ahhh,0
ihh aaah ohh uhhh ah uuuh ihhh iih iih uuh ohhh,0
ahh eh ih uhh aaah oooh eeh aaah,1
uuuh ehh iih iiih oooh ahhh ohh eeeh ah eh oh ahh ooh ohh ahh iiih oooh ah aah,2
ehhh ohhh ihhh aaah uhhh aaah uh uuh ehhh uuh ohh ooh iiih oh uhh uuh ih uuh ih ahh ahhh eeeh ohh ohh oooh oh uhhh aah,2
ahh ahh oooh iiih iih ooh uuh eeeh uhh ah uuuh eh uh uh,2
ah uhh ohh eh oooh ih ihhh ih uuh ohh aah,2
iiih aah aaah iih ahh ohh uhhh ih ihhh aah ahhh ooh iih ihhh ahhh eeh uhh uhh ohh eeeh ahhh ahh ohh,2
ooh ahh ah uuh iih oooh eh uuuh ehhh ihhh ahh ohhh eeeh eeeh eeh oooh iih oooh iiih uuuh uh aaah,0
uuuh eeeh ohh uhhh aah ohh ohhh uhhh ihh ihhh eh iiih ihhh eeh ehh ooh ah ohh ihhh iih oooh ehhh ah iiih eh ih eeh,2
ohhh iiih uh aaah uuuh oooh ehhh ih ah ah aaah iiih uuh eh ahhh ihhh ihh ahh ohhh oooh,0
oh aah uuuh uhh uhh ihh ah eeh uhhh uuh uhhh ohh ohhh iiih aaah oh aaah iiih ooh iiih aaah ihh aah,0
ihh eeh aaah ehh ihhh oooh uhhh aaah ohhh iih ih aaah ih oooh iih ah eh,0
aah ehhh eeeh ehh uh eeh uhhh uuuh ohhh uuh oh ihh uuuh ih uhh ahhh uhhh ih ohh ehhh aah iih ahhh iiih oooh eeeh aaah ooh aah,1
ehhh aaah ih uhh ihh ihh ooh ooh,2
eh ohh oooh uuh aah eh uhhh uh oooh eeeh ahhh ihh eh eeeh iiih ooh ihhh uh ooh oh oooh uuuh ehhh eeh aah uh uuh aah eeh ohhh,2
eeeh ooh eeeh uuuh ehhh ohh iiih,2
oooh uuh eh ooh aah ohh ohh oooh uhhh ehh ahhh uh oooh ehhh ahhh uhh ooh iih ohh eeeh uh ihhh oooh ehh iih ahhh,0
uhhh aah ohh ooh ih ah ah ahhh uuh aah uuh eeh uuuh uh eeh ooh ihh iih eeh iiih eeeh uhh uhh ah,1
eeeh aaah ah uh uhhh,0
ahh ihhh eeh ih ooh uhhh iiih ih iih eeh ihh ohhh uhh ahh,2
eh ihhh uhh ooh aah aah uuh iih ohhh oh uuuh uh ehh iih uuuh ehhh eeeh oooh eeeh ahh ehh uhh eeh uhhh aaah uhh eeh eeh,0
ahhh uuuh uuh uh uhhh eeh oh ahh,0
ahh ooh iiih eeeh uh ohhh ih uuh ihhh ahhh uhhh aaah ahh iih oh ah iih aaah iih ah ehh uuh uuh ooh ehhh ahh ohh,2
uhhh ohh ahh iih ihhh uhhh ooh ah ah eeh ahhh ih eh ohhh oh eeh uhhh ohhh ahhh uhhh ooh ahhh iiih eeh ehh uh ihh uuh uhhh eeeh,0
ahh uuuh ihh eeeh iiih uuuh ehh oh aaah ahhh eeeh,0
ohhh ahhh ihh aah ehh oooh ah,0
ehh iiih iih ih uuuh ohh ih ihh eh aah ihhh aaah ah uuh aah ih ooh uuh eeeh aaah ohh uh ahhh eeh ahh ohhh aaah eeh ehh,2
ahh ohhh aaah ehh uuh uuh ah uhhh ahh ah eeeh ohh eeh ihhh oooh ehh aaah uhhh uuuh uuuh ooh,0
ahhh eeeh aah ih ahh uuuh uhh ahhh oooh ihhh iiih ehh,2
aaah uuh uuh uhhh eeeh ohh ihhh ehhh ih ihh iiih uhhh ehhh ohhh ohhh ihhh ahh ehh ahh iih ahhh,2
aaah oooh uuh ohh eeh eeeh oooh iiih aah uuh uhh ooh ehh ihhh uhhh ooh ih uuh ohhh ohhh ehhh oh uhhh iiih uhh iiih ihh ohh aah,2
aah uh eeeh uhh ih eeeh aaah aaah ohh eeeh eeh eh aah oooh uuh iiih ihhh uuuh aah ehhh ooh uuuh oooh oh,2
uhhh uh ohh uhh aah ah,1
oooh ehh uuh ahh iiih ihh eh ih ihhh ihh ooh iiih,2
uhh ihhh ih uhhh eh aaah aah ehhh uhh oh ohhh ahhh eh uuh ohhh ohh uuh ohh eeh ih iiih,2
eh oooh ah ehh ehhh iiih oooh uh ih eeh iih ahhh,0
eh eh ahhh ooh eh ah iih ooh uhhh iiih eh ihhh eeeh ehhh uh aah ih oh ihhh oh uhhh eeh ihhh eeeh ehhh,2
ahhh uhh oh iih iiih uuh ihhh eeh uhhh ooh uhh ohh ih iiih uuh ih uhhh iiih ehh ohh uhh ohh,2
ehhh aaah uuh ihhh ihhh ohhh ahh eeeh aaah ooh iih ehh ah,2
iiih eeeh ahhh iiih ihh ahh aaah eeh eh iiih ahh ah aaah ah iih uhhh iiih ahh ohhh uhh uuuh ahhh,0
iiih iiih uuh eeh aah uhh oh ihh iiih ehh oh ohh ihhh eeh ehhh eeeh ohh aah uhhh ehh ihhh iiih ah uuh eeeh uh uhhh,2
ehh oooh eeh uuuh uh ihh eh ehhh ihhh uuh oh ehhh uhh eeh ahhh ih ooh oooh ohhh ehh ehh oh uhh ehhh uhh eeh,0
eh uhhh ahhh iiih iiih ooh uuuh ehhh ahhh ehh ah ehh oh,0
ih oh aaah ihh uuh ihh,0
aah uuuh uuuh ohhh eh ooh ohhh iih,0
aaah aaah uhhh eh ohhh ahhh uuuh oooh ohh ihh eh ahh ih eeh ihh ahh uuh ooh oooh aaah eeeh ah uhhh uhhh,0
iih ih ahh ihhh aah uuh ahhh,2
eeeh ah ooh ih ihhh aah ahh ihhh ehhh ohh ohh oooh aaah ah eh oooh uuuh uuh ohhh uuuh ah ih ehh ah,2
ahhh uhhh oh ihhh aaah ih iih ooh ohhh ih ohh ihh,0
ih eh iih aah iih eh eeh uuuh ih aaah ih ihhh uuh ih,2
aah ohhh eeeh ahh ihh,2
iiih iih uhh ahh ehhh uuuh iih ooh eh oh uuh uhh uhhh eh ehhh ooh aaah ooh aah,2
ehh uhhh ooh ohh ihh eh ihhh iiih,2
aah eh ooh ahh eh eeh ohh uhhh eeh ehhh uhh eh ehhh ohhh eeeh ooh,2
iiih ihhh ahh oh eeeh uhhh ihh ehh aaah aaah iiih eh iiih ih iih ahhh uhhh uh ehh iih ah ahhh eeh ohh oooh ahh aaah uhhh ehh,0
ehhh ehh ihhh aaah oooh uhh ahh uh eh aah eh aaah ooh uhh ooh ih ehh ehh ehh uhh uh,2
ohh oh ehhh eeeh iih aah ih ihhh ehhh ehh ahh ahhh ohh uhh ehh eh,2
ehhh ooh oooh ah ehhh iiih uh eeh uuuh ah aaah uhh uhhh ihhh eeh ooh aaah ah,0
aaah ihh ehhh uhhh uhh oooh eeeh uh ohh ih ih ohh iih ohh,2
aaah ihh oh ahh ah eh,0
aah ohh aaah uh uuh aaah ih ahh ih oh ahhh ooh uhh oooh ah ihhh ehh uhh,2
uuh iiih ohh ehh ih uhh ihhh ohhh ah ehh uhhh iih,1
iiih aah oooh aaah ih ahhh eeeh aah ihh ooh iih,2
eeeh aah uh uhhh oh uhh ehhh uhh ih oooh uhhh uhh oh ih ohh ehh ihhh iiih ahh uhhh eeeh oooh ehhh oh aah uuh aaah ooh uh ihh,2
ihh ih ah eh uh eh eh,2
eh eh ohhh ooh ihh uuuh ehhh ih uuh eh aaah ah uhhh ih ehhh ihh ehhh uhh oh ih oh uh ihh eeh iih ehhh uh uhh,1
ehh uuh ihhh ih eeh oh uh iih eeh ih ehhh iih uhh ohhh uh uh aah oooh ohh aah eeeh ohh uuh ihhh uhh,2
uuuh ohh uuuh ihh ooh uhhh ih uhh eeeh ahhh ooh uh uhh uh,1
ah ahh oh ooh oh iiih eh ohh uh ahh uhhh uhh ehhh ooh iih ihh ihh eh aah ehh ohhh ah iiih ihhh ehh uhh iih,2
ahh oooh aah uuh oooh uh ooh iih ihh ehh ehhh uh oooh aah ih ooh ohhh uhh,1
eeeh ahhh ohh aaah ihh eeh eh ehhh uuh,2
uhhh iiih oooh ihh oh ih ihh uhhh uh ah eeeh ahh ih ehhh uhh ah eeeh ih oooh ihhh,1
ihh aah eeeh ahhh ah eeh ohh ih,1
aah ihh uhhh ihhh uuuh iiih uuuh aaah eeeh ohh eeh aah uhh uh ihh oooh oooh eeeh ah eeh aaah uuh uuh iiih,0
ah uuh iiih uh ih iiih uh ahhh oh iiih ahhh uuh oh iih oh uhh,0
aaah eeh ohh ah ohh aaah ah ehh ehh iiih eh aah ohh oooh ih,1
ohhh ah ihhh eh ihh aah eeh uuuh ahh ihh,0
ohhh ih ooh uhhh uh oh ahhh eeeh iih ihhh uuh ehh ehhh oh aaah iiih oh iih oooh oh uuh uh aaah uuuh,0
aaah oooh ahh iih ehh aah ahh ohhh ah ehhh uuh ahhh uuuh ohh ohh ohhh oooh eeeh ohhh ahhh uuh ahh iiih,1
ehh eh ah ehh eeh ehh uuh eh ihhh uh eeeh aah ah aah ah ehhh,1
uhh ahh iih ih eh ehhh ihh,2
ahh ahhh aah uhhh uuuh oooh ohhh aaah ahhh ih eeh eeh ihhh uhh ihh uuh iih,0
uh oh uhh ihhh ihhh ahhh ahhh ihh oh ahh ehhh oh ehhh ihhh ohh,2
oooh aaah iiih uuuh iiih,1
uhhh uh ahh uuh ahh uhhh uuuh ohh ehhh ihhh uhh ih ehhh ihh aaah ahhh ehh uh eeh ahh eh eeh ahh eeh ahhh uuuh,0
ehh eeh ohh eeeh oh,1
ihh ah iiih aaah uhh ooh ihh ehh ehhh ehh uhhh,0
eh iih ihhh aaah ahhh eeh ehh ohhh aah aaah iih,0
ahhh aah uuh uhh oh aah ohh oooh iih iiih eeeh ohh oh ehh iih ohh eeeh uuuh ihh aaah ohhh oooh ihh ehh ehh iih ahhh uhhh,0
uhhh uhh ihhh ih uhh ahhh ah ih ihh ah iiih oooh uuh uh aah eeh eeeh ahhh,1
aah ohhh uhh ah ohh eeh,1
ih iih eeh aah ahh ah ah uhhh ah eeh oh ihh ohhh eh uuuh,0
aaah iih ah oh ehh eh ihhh ah oh uuh oh ooh uhh ohh eeh aaah ahhh ehhh uhh ohhh,0
ohhh ohhh oh uuh eeeh oooh ooh iih ih iih uuuh iiih ahh ohh uuuh ih ah iih ehh eeeh iih aah ooh ohhh eh,1
oh aaah eh uuh aah oooh iiih aah uhh ooh uhh ahh ihhh uuuh ihh ihhh ih eh ah eeh aah uhh ehh eeeh ahhh oh,2
uuh aaah ih uhh eh uhhh iiih ehhh ihh aaah ahhh ihhh ahhh eh aaah uhhh aah ih aaah ooh ihh ahhh aaah ihh uhh ohhh,0
ih ehh uh eeeh eeh iiih ahh oooh ahh ehh ihhh uhh uuh ohhh ohh eh ohh iih ahhh ah oh ahh uhhh oooh ooh aaah ah iiih ahhh,1
uh ohh aaah uhh eeh eh ihhh iiih oh aaah aah eeeh eeh uuh ahh ahhh ahh ehh ihhh ohh oooh,2
uhhh ehhh aah uuuh ihhh ohhh ohh aaah oooh ahhh uh ehhh ah ih uuuh ihh ehh ohhh eeeh ihh eh oh ooh eeeh ih aaah ehhh uhh,0
aaah uhh ihhh ohh ehhh ohh eeh ohh iiih oooh ehh ahhh uh uh aah ooh oooh eh ihhh aaah uh ooh ahhh ooh aaah uhhh,1
ihhh uhhh iiih ohh ehh aah ehh ah uhh iih eh ohhh ihh eeh ihhh eeh aaah uhhh ohhh iih ooh ihhh ahhh ooh ehh ooh ooh ahh,0
uhhh ooh ooh ihh uhh uuh ihh ehh eeeh iih ihh ehh eh ahhh ahhh eh ih aaah uuuh eeeh ohhh,0
ihh aah uhh aaah iiih ehhh ih ohh uhhh ehh iiih ehhh ehh,2
eeh ahhh uhh ohh uh,1
ooh uh ahh ah uh ih eeh aaah ihhh ih oooh ih,1
iih ihh aaah ah eh uhh ahh ihh oh ehh ah eeeh iiih ihhh ohh eeeh ehh ohh ehh eeeh aaah,1
ehhh ah aaah eeh eh ihh oh iiih ehhh uh oooh ahh eh ah eeh aaah ih eeh ehhh ih oooh oooh ohh uuuh ooh aah uh ihhh ihhh,1
ihhh ihh aah ehh ohhh ih ehh aaah oh ih iih ihh ahhh eeh uhhh uuh,0
aah ih eeh ih uhhh ohhh oooh uhh ihh uh iiih ihhh ihhh eh aah ehh ih aaah uuh ehhh ehh ah ih ah oooh ah ahhh,1
aah aaah oh ahhh aah uh ohh uh uh ehhh uhh ahhh aaah uuuh ohhh uhhh aaah oooh iih uuh uuh,0
ooh iih ooh uuh ooh oh ihh ohhh ah,1
ihhh eeh iih ahhh aaah uh ihhh ohhh ooh iiih ehhh ahhh ih ahh eh ooh iiih ooh oh iih,2
oh iih ehh uh ooh eeh ahhh oh ehh uuuh eeeh ohh ahhh ih ihh iiih ihh uh uuh ihhh ihh oooh,0
eh aah ohhh uuh ehh aah ooh aaah ah oh eeh eeeh ahhh eeeh eeh,1
aaah uh aah ahhh iiih eeeh uhhh uhh ooh oh eeeh oh ahh eh aah oooh ooh uhhh uhhh ihh iih,1
ah ohh ohh ohh ooh ihhh ah oh oooh ihhh oooh ahh iih uh ooh eh uhh ooh ahhh aaah uh aaah ahh ihh ohhh,1
uuh ooh eeh aaah ihh uh ih iih iiih eeh ihhh eeh uhh ahh iiih uhhh ehhh aah ooh uhh uuh eh uuuh uuuh aaah iiih ihh ooh ah,2
ehh uhhh ehhh uhhh ihh iih uuh,0
ehh uuuh aah uhhh ih eeh eeeh eeeh ahh ahhh eh ihhh uuuh oooh aah uhhh oooh ahh iih ihh,0
aah ih iiih ehhh ohh ahh aah uhh ihhh eeh,2
aah eeh uhh ahhh ahhh ih uhh uuuh ohh eeeh iih uuh eh ihh ah uuh eeeh aah ehh aaah uh ihhh ahh ohhh,2
ahhh oooh aah ehhh iih eh aaah eh uuuh uh eh iih aaah ih iiih ehhh aaah iih aah eeh eh eh eeeh uuh ahhh,2
ahhh eeeh ehhh uuuh iih ahhh ehh aaah iiih uhh ihhh ihhh uuuh,1
eh ahhh iih ihhh eh uh ahh eeh uhh ehh uh eh uhh eh,2
iih ahh ohh ohhh oooh eeh uh ah,0
eh ohhh oh ohhh ooh iiih ehhh ihh uuuh iih uhh ihhh ehhh ehhh uuuh ohhh uhh ohh ah eeeh uuuh,2
ooh uhh ih uhh iiih uhh uhh ohh ih ah ooh iiih uuh uh oooh iiih ahh ohh uhh,2
aah uhh ih ih ahhh eeeh ohhh oh uh ah uhhh ahhh oooh,0
iih ahhh ihh ahh ah ohh,0
oh ihhh ohhh ohhh uuh oh iiih oh eeh ih ah iih ahh ooh ihh eeh aah oooh,0
ihh ehh ahhh uhh ihh eeeh uh aah,0
ehhh eeh ahhh ehhh eeeh ihh ih uhhh uhhh ohhh ihhh eeeh eh uhhh eeeh ohh,2
uhhh ohh iiih ohhh ooh eeeh aaah ihhh ih ahhh ehhh ohhh uuh uhh iih uuuh uhhh ihh uhh aaah ooh eeeh ooh iih ih ihhh iiih,2
ah oooh ihhh eeeh ehhh aaah ahhh uh ah ehh iih ahhh uh eeeh eeh ih uuuh uh ahhh eh ihhh ih eeeh ohhh,0
ahh ahh ah iih ihh iih ehh ahhh iiih uuh uhhh eh ohh uhh aah iiih ohh ehh eeeh aah,2
ahhh ah uh ih ooh uuh oh aaah ih aaah uuh oh,0
uh ohh uuh ahh uhh ihh ahhh ihhh iiih ohhh uh aaah iiih uuuh ahh aaah,1
aah ihh uhhh ohh ahhh ohh eeh ahhh ah aah oh ohhh ahh,0
eeeh eeeh uhh uuh ih ohhh ohhh,2
uhhh ehh ihh ihhh ihhh uh iih eeh ohhh oh ihh ahhh oh ah ahhh ah ehh uuh ahh eeeh ahh,0
ehh ihhh ih uuh iiih iih ihh ohhh uhh ihhh uhh oh iih uuuh uhhh oooh uh ohhh oooh ooh iiih ohhh oh,0
ohhh ahhh aah iiih ohhh oooh ohh eeeh eeeh iih ih aah uhhh oh ah uhhh aaah eeeh eeeh ehhh ihh ahh uh eeeh ih ehh eeh,1
iih eh iiih aaah ehhh iiih uuh iih aah ihhh aah ih aah uuuh oh ihh iih ahh ohhh oooh ohhh ihh ehhh uhh ehh uh ohhh,1
oh ihhh iiih uhhh iih uhhh eeeh iih oooh ahh iih ihh ohh,0
uuh ahhh ooh ih ohh eeeh oooh ah aah iih iiih ih ahh oh uh ooh uuh uuh uuuh uh ohh oh iih,2
eeh eeeh iiih oooh uuuh iih uuuh eeh oh iih ahhh oh uh ohhh ihh ah uhh aah ah ah,0
eeeh eh ihh iiih ahh uhh ahh ahhh eeeh oh ehhh uuuh uhh ehhh eh uhhh ahhh ahh iiih iih ahhh uuuh,2
uhh ihhh ih ehhh uhhh aaah ohhh eeeh eh aaah eeh uh ehhh ehh ihhh iiih uhhh ihh uhh,2
ihh uh oooh uhhh iih uuh ohh aah iiih uhh oooh eh aaah oh,0
eh eeh uhh eeeh eeh ooh ihh eeh ohhh iih iih uuh uhhh,0
ehhh eh ohh ooh oh ah iiih ohh uhh ah uhhh uuh uh uuh ihh ahh ihh uuuh oh ehh oooh ooh iiih iih iiih,2
eh uh ihhh eeh ooh ehh ahhh uh oh oh uuuh aah ih eeeh,0
ooh uhh oh aaah ohhh uhhh,0
ah eeh uuuh ahhh ih ah ohh oh ihh,0
uhh eeeh eeeh ahhh iiih uuh ooh iiih ooh uhh ehh ahhh,2
aaah ah oooh ehh ah ihh ihh eh aaah ooh ehhh uhhh ih ih ahh aah iiih oh ah iiih uhh oh aah ah ohhh uuh,0
aah uuuh oh ooh eeeh eeeh,2
ehhh uuuh uhhh ahhh ih uuh iih,1
ohh ihhh aaah uuh ih ihhh eeh ahhh ahh eeh oooh uhhh ooh ohh,2
ihhh oooh oh iiih uh eh oh ohhh ehh uuh eeeh uhhh uuh ohh ehhh,2
eh uh ahhh oh ohhh aah eeeh eeeh eh ahhh ehh eeh uhh eeh ehh uhhh eeeh ihhh eeh,0
ohh uh uhhh ih ahhh ohh eeeh ohhh ehh ahhh ehh ih ah ihh ooh ooh eeeh iiih uuuh ohh ihh eeeh uhhh eh eh iiih ih,2
uuuh aah ehhh ihh eeeh ohhh oh eeh ehh uuuh ahh,0
aah oooh oooh ooh ahh eeeh ihh ohhh eeeh ah eeh ihh uhh,1
eeh iiih ahh iiih ah ahh ih oh aaah uhh ehh eeh ehhh,2
